-- phpMyAdmin SQL Dump
-- version 4.9.5deb2
-- https://www.phpmyadmin.net/
--
-- Host: localhost:3306
-- Generation Time: Oct 05, 2020 at 05:32 PM
-- Server version: 8.0.21
-- PHP Version: 7.2.33-1+ubuntu20.04.1+deb.sury.org+1

SET SQL_MODE = "NO_AUTO_VALUE_ON_ZERO";
SET AUTOCOMMIT = 0;
START TRANSACTION;
SET time_zone = "+00:00";


/*!40101 SET @OLD_CHARACTER_SET_CLIENT=@@CHARACTER_SET_CLIENT */;
/*!40101 SET @OLD_CHARACTER_SET_RESULTS=@@CHARACTER_SET_RESULTS */;
/*!40101 SET @OLD_COLLATION_CONNECTION=@@COLLATION_CONNECTION */;
/*!40101 SET NAMES utf8mb4 */;

--
-- Database: `challenge_pmis`
--

-- --------------------------------------------------------

--
-- Table structure for table `contractor_authorized_person`
--

CREATE TABLE `contractor_authorized_person` (
  `id` int NOT NULL,
  `authorized_person_id` int UNSIGNED NOT NULL,
  `contractor_id` bigint UNSIGNED NOT NULL
) ENGINE=InnoDB DEFAULT CHARSET=latin1;

--
-- Dumping data for table `contractor_authorized_person`
--

INSERT INTO `contractor_authorized_person` (`id`, `authorized_person_id`, `contractor_id`) VALUES
(41, 60, 1615),
(42, 61, 1620),
(43, 59, 1626),
(44, 62, 1626),
(45, 63, 1629),
(46, 31, 1659),
(47, 32, 1659),
(48, 33, 1660),
(49, 86, 1663),
(50, 9, 1745),
(51, 64, 1814),
(52, 65, 1843),
(53, 66, 1934),
(54, 34, 1938),
(55, 22, 1943),
(56, 67, 1944),
(57, 68, 1945),
(58, 36, 1959),
(59, 37, 1959),
(60, 38, 1960),
(61, 39, 1961),
(62, 87, 1989),
(63, 69, 2010),
(64, 40, 2021),
(65, 41, 2024),
(66, 42, 2024),
(67, 43, 2039),
(68, 44, 2039),
(69, 58, 2046),
(70, 88, 2056),
(71, 19, 2070),
(72, 26, 2080),
(73, 18, 2089),
(74, 13, 2092),
(75, 14, 2094),
(76, 93, 2100),
(77, 89, 2101),
(78, 23, 2138),
(79, 24, 2140),
(80, 25, 2141),
(81, 61, 2146),
(82, 2, 2154),
(83, 7, 2166),
(84, 3, 2168),
(85, 1, 2169),
(86, 45, 2178),
(87, 46, 2179),
(88, 48, 2181),
(89, 49, 2181),
(90, 51, 2183),
(91, 52, 2183),
(92, 77, 2198),
(93, 16, 2245),
(94, 15, 2246),
(95, 91, 2248),
(96, 92, 2251),
(97, 94, 2252),
(98, 21, 2254),
(99, 20, 2290),
(100, 72, 2300),
(101, 71, 2301),
(102, 73, 2302),
(103, 78, 2302),
(104, 74, 2303),
(105, 75, 2304),
(106, 76, 2305),
(107, 79, 2306),
(108, 80, 2307),
(109, 81, 2308),
(110, 82, 2309),
(111, 5, 2322),
(112, 11, 2323),
(113, 50, 2325),
(114, 53, 2326),
(115, 54, 2327),
(116, 55, 2328),
(117, 56, 2328),
(118, 57, 2329),
(119, 27, 2335),
(120, 12, 2351),
(121, 29, 2359),
(122, 28, 2360),
(123, 30, 2361),
(124, 84, 2362),
(125, 10, 2363),
(126, 83, 2363),
(127, 47, 2370),
(128, 6, 2376),
(129, 4, 2377),
(130, 17, 2381),
(131, 8, 2382),
(132, 35, 2390),
(133, 85, 2391),
(134, 90, 2393),
(135, 95, 2393),
(136, 96, 2394),
(137, 97, 2395),
(138, 89, 2249),
(140, 98, 1427),
(141, 100, 1502),
(142, 101, 1771),
(144, 103, 1772),
(145, 104, 1773),
(146, 105, 1773),
(147, 106, 1962),
(148, 107, 1976),
(149, 54, 2031),
(150, 54, 1959),
(151, 106, 1939),
(152, 108, 2033),
(153, 109, 1877),
(154, 110, 1877),
(155, 111, 2039),
(156, 112, 2039),
(157, 113, 2188),
(158, 114, 2190),
(159, 115, 2370),
(160, 54, 2191),
(161, 116, 2027),
(162, 117, 2400),
(163, 118, 2401),
(164, 119, 2402),
(165, 120, 2402),
(166, 93, 2250),
(167, 121, 2135),
(168, 122, 2089),
(169, 122, 2396),
(170, 123, 2404),
(171, 124, 2082),
(172, 125, 1969),
(173, 126, 1599),
(174, 127, 1790),
(175, 128, 1788),
(176, 129, 1582),
(177, 130, 2517),
(178, 131, 2518),
(179, 132, 2041),
(180, 133, 2519),
(181, 134, 1599),
(182, 135, 2525),
(183, 136, 2048),
(184, 137, 2206),
(185, 138, 2531),
(186, 139, 2532),
(187, 140, 2206),
(188, 141, 2325),
(189, 142, 2486),
(190, 143, 2487),
(192, 145, 2407),
(193, 146, 2405),
(194, 45, 2409),
(195, 46, 2488),
(196, 53, 2489),
(197, 46, 2407),
(198, 147, 2403),
(199, 46, 2406),
(200, 57, 2182),
(201, 148, 2490),
(202, 142, 2408),
(203, 149, 2491),
(204, 150, 2492),
(205, 151, 2493),
(206, 56, 2027),
(207, 142, 2495),
(208, 152, 2496),
(209, 153, 2170),
(210, 154, 2212),
(211, 155, 2399),
(212, 156, 2526),
(213, 157, 2469),
(214, 116, 2527),
(215, 158, 2185),
(216, 159, 2406),
(217, 160, 2470),
(218, 47, 2528),
(219, 161, 2529),
(220, 162, 2530),
(221, 163, 2039),
(222, 164, 2029),
(223, 74, 2332),
(224, 165, 2302),
(225, 166, 2533),
(226, 167, 2534),
(227, 168, 2524),
(237, 177, 2035),
(239, 179, 1819),
(240, 180, 1820),
(241, 181, 1943),
(242, 182, 2128),
(243, 183, 2523),
(244, 184, 2130),
(245, 183, 1936),
(246, 185, 2132),
(247, 186, 2130),
(248, 187, 2137),
(249, 188, 2287),
(250, 189, 2290),
(251, 190, 2291),
(252, 191, 2292),
(253, 192, 2293),
(254, 193, 2294),
(255, 191, 2358),
(256, 194, 2538),
(257, 195, 2430),
(258, 196, 2431),
(259, 187, 2299),
(260, 197, 2432),
(261, 198, 2433),
(262, 199, 2434),
(263, 194, 2436),
(264, 194, 2437),
(265, 199, 2431),
(266, 179, 2438),
(267, 190, 2439),
(268, 190, 2440),
(269, 200, 2441),
(270, 201, 2297),
(271, 202, 2298),
(272, 203, 2299),
(273, 204, 2453),
(274, 205, 2454),
(275, 206, 2455),
(276, 207, 2271),
(277, 208, 1535),
(278, 209, 2536),
(279, 54, 2546),
(280, 210, 2088),
(281, 211, 2503),
(282, 212, 2504),
(283, 213, 2465),
(284, 214, 2466),
(285, 215, 2467),
(286, 216, 2468),
(287, 217, 2388),
(288, 218, 2385),
(289, 219, 2397),
(290, 220, 2485),
(291, 221, 1385),
(292, 222, 2384),
(293, 223, 2398),
(294, 224, 2418),
(295, 225, 2420),
(296, 226, 2421),
(297, 227, 2422),
(298, 228, 2550),
(299, 229, 2551),
(300, 230, 2552),
(301, 231, 2553),
(302, 122, 2555),
(303, 122, 2556),
(304, 232, 2557),
(305, 233, 2558),
(306, 234, 2519),
(307, 235, 2419),
(308, 236, 2421),
(309, 226, 2422),
(310, 237, 2480),
(311, 24, 2559),
(312, 238, 2560),
(313, 239, 2481),
(314, 240, 2482),
(315, 241, 2561),
(316, 29, 2483),
(317, 29, 2562),
(318, 25, 2563),
(319, 242, 2484),
(320, 243, 2065),
(321, 244, 2203),
(322, 245, 2218),
(323, 246, 2021),
(324, 177, 2220),
(325, 247, 2410),
(326, 248, 2407),
(327, 249, 2505),
(328, 250, 2506),
(329, 251, 2507),
(330, 252, 2508),
(331, 253, 2509),
(332, 254, 2510),
(333, 255, 2511),
(334, 256, 2481),
(335, 257, 2353),
(336, 258, 2512),
(337, 259, 2513),
(338, 260, 1117),
(339, 261, 2514),
(340, 262, 2350),
(341, 263, 2164),
(342, 264, 2568),
(343, 265, 1908),
(344, 266, 2456),
(345, 267, 2457),
(346, 268, 2458),
(347, 269, 2121),
(348, 270, 2459),
(349, 270, 2460),
(350, 271, 2461),
(351, 272, 2285),
(352, 250, 2462),
(353, 273, 2356),
(354, 274, 2463),
(355, 275, 2464),
(356, 276, 2347),
(357, 207, 2347),
(358, 277, 2029),
(359, 278, 2184),
(360, 279, 2264),
(361, 280, 1751),
(362, 281, 2308),
(363, 282, 2412),
(364, 282, 2411),
(365, 283, 2413),
(366, 282, 2414),
(367, 284, 2415),
(368, 282, 2337),
(369, 285, 2338),
(370, 285, 1761),
(371, 284, 2250),
(372, 284, 2100),
(373, 285, 1535),
(374, 286, 2531),
(375, 287, 2112),
(376, 288, 2302),
(377, 289, 2571),
(378, 290, 1913),
(379, 291, 2041),
(380, 292, 2312),
(381, 290, 2043),
(382, 293, 2331),
(383, 294, 2201),
(384, 295, 2198),
(385, 296, 2203),
(386, 295, 2332),
(387, 297, 2332),
(388, 298, 1590),
(389, 257, 2357),
(390, 299, 2355),
(391, 300, 2547),
(392, 301, 1389),
(393, 302, 2515),
(394, 303, 2312),
(395, 304, 2044),
(396, 305, 1750),
(397, 306, 2206),
(398, 307, 2018),
(400, 307, 2044),
(401, 308, 2035),
(402, 309, 2423),
(403, 139, 2424),
(404, 310, 2516),
(405, 311, 2572),
(406, 312, 2573),
(407, 50, 1495),
(408, 313, 1391),
(409, 314, 1594),
(410, 290, 1947),
(411, 290, 2204),
(412, 315, 2397),
(413, 316, 2522),
(414, 317, 2574),
(415, 35, 2575),
(416, 318, 2576),
(417, 115, 2577),
(418, 319, 2578),
(419, 320, 1413),
(420, 321, 1653),
(421, 322, 1276),
(422, 320, 1893),
(423, 323, 1567),
(424, 324, 1754),
(425, 325, 2019),
(426, 326, 2046),
(427, 327, 2313),
(428, 327, 2050),
(429, 328, 2053),
(430, 329, 2425),
(431, 329, 1893),
(432, 330, 2426),
(433, 331, 2209),
(434, 332, 2210),
(435, 333, 2373),
(436, 334, 2427),
(437, 335, 2428),
(438, 336, 2429),
(439, 337, 2579),
(440, 338, 2580),
(441, 339, 2581),
(442, 340, 1974),
(443, 122, 2582),
(444, 341, 2297),
(445, 342, 2583),
(446, 343, 2030),
(447, 344, 2186),
(448, 345, 2185),
(449, 343, 2187),
(450, 346, 1499),
(451, 347, 1591),
(452, 348, 2089),
(453, 349, 2084),
(454, 350, 1541),
(455, 351, 1823),
(456, 352, 1824),
(457, 353, 2056),
(458, 109, 2331),
(459, 109, 1747),
(460, 354, 2203),
(461, 355, 2197),
(462, 356, 2193),
(463, 356, 2037),
(464, 109, 2192),
(465, 357, 2193),
(466, 358, 2039),
(467, 109, 2392),
(468, 359, 1591),
(469, 358, 2130),
(470, 355, 2035),
(471, 357, 2040),
(472, 71, 1626),
(473, 360, 2014),
(474, 361, 1821),
(475, 362, 1766),
(476, 363, 2156),
(477, 364, 1946),
(478, 365, 2132),
(479, 366, 2315),
(480, 367, 1485),
(481, 368, 2239),
(482, 369, 1652),
(483, 232, 2239),
(484, 370, 1785),
(485, 371, 1975),
(486, 371, 1976),
(487, 370, 1778),
(488, 372, 1896),
(489, 373, 2087),
(490, 374, 2088),
(491, 375, 1744),
(492, 376, 2088),
(493, 377, 2585),
(494, 378, 2549),
(495, 379, 2586),
(496, 380, 2375),
(497, 381, 2587),
(498, 382, 2588),
(499, 383, 2056),
(500, 384, 1755),
(501, 385, 2523),
(502, 386, 2373),
(503, 387, 2311),
(504, 388, 2589),
(505, 389, 2590),
(506, 390, 2591),
(507, 391, 2592),
(508, 392, 2335),
(509, 393, 1974),
(510, 394, 2368),
(511, 395, 2589),
(512, 396, 2540),
(513, 397, 2571),
(514, 398, 2345),
(515, 399, 2594),
(516, 400, 2595),
(517, 401, 2343),
(518, 402, 2344),
(519, 403, 2596),
(520, 404, 2102),
(521, 405, 2597),
(522, 406, 2352),
(523, 407, 2344),
(524, 408, 2345),
(525, 409, 2602),
(526, 410, 2380),
(527, 411, 2039),
(528, 412, 2605),
(529, 413, 2605),
(530, 414, 2603),
(531, 115, 2610),
(532, 415, 2056),
(533, 416, 2320),
(534, 417, 2161),
(535, 418, 1823),
(536, 360, 2155),
(537, 419, 2611),
(538, 420, 2212),
(539, 421, 2212),
(540, 422, 2229),
(541, 360, 2613),
(542, 423, 1745),
(543, 424, 2316),
(544, 425, 2059),
(545, 426, 2616),
(546, 427, 2246),
(547, 428, 2621),
(548, 429, 2261),
(549, 430, 2556),
(551, 325, 1990),
(552, 432, 2671),
(553, 433, 2048),
(554, 434, 2449),
(555, 435, 2612),
(556, 436, 2725),
(557, 437, 2673),
(558, 438, 2647),
(559, 439, 2747);

-- --------------------------------------------------------

--
-- Table structure for table `daily_progresses`
--

CREATE TABLE `daily_progresses` (
  `id` bigint UNSIGNED NOT NULL,
  `project_id` int UNSIGNED NOT NULL,
  `date` date NOT NULL,
  `manpower` longtext CHARACTER SET utf8 COLLATE utf8_unicode_ci,
  `equipments` longtext CHARACTER SET utf8 COLLATE utf8_unicode_ci,
  `materials` longtext CHARACTER SET utf8 COLLATE utf8_unicode_ci,
  `weather` text CHARACTER SET utf8 COLLATE utf8_unicode_ci,
  `temperature` text CHARACTER SET utf8 COLLATE utf8_unicode_ci,
  `problems` longtext CHARACTER SET utf8 COLLATE utf8_unicode_ci,
  `activities` longtext CHARACTER SET utf8 COLLATE utf8_unicode_ci,
  `created_by` int UNSIGNED NOT NULL,
  `updated_by` int UNSIGNED NOT NULL,
  `status` tinyint(1) NOT NULL DEFAULT '0',
  `created_at` timestamp NULL DEFAULT NULL,
  `updated_at` timestamp NULL DEFAULT NULL,
  `samples` longtext CHARACTER SET utf8 COLLATE utf8_unicode_ci,
  `weather_remarks` varchar(255) CHARACTER SET utf8 COLLATE utf8_unicode_ci DEFAULT NULL
) ENGINE=InnoDB DEFAULT CHARSET=utf8 COLLATE=utf8_unicode_ci;

--
-- Dumping data for table `daily_progresses`
--

INSERT INTO `daily_progresses` (`id`, `project_id`, `date`, `manpower`, `equipments`, `materials`, `weather`, `temperature`, `problems`, `activities`, `created_by`, `updated_by`, `status`, `created_at`, `updated_at`, `samples`, `weather_remarks`) VALUES
(18, 17091, '2077-05-27', '{\"Client\":{\"Project Chief\":{\"id\":[\"82\"],\"attendence\":{\"82\":\"1\"}},\"Deputy Project Chief\":{\"id\":[\"83\"],\"attendence\":{\"83\":\"1\"}},\"Engineer\":{\"id\":[\"84\",\"85\"],\"attendence\":{\"84\":\"1\",\"85\":\"1\"}},\"Supervisor\":{\"id\":[\"87\"],\"attendence\":{\"87\":\"1\"}},\"Site Supervisor Engineer\":{\"id\":[\"78\",\"79\",\"81\",\"80\"],\"attendence\":{\"78\":\"1\",\"79\":\"1\",\"81\":\"1\",\"80\":\"1\"}},\"Sub Engineer\":{\"id\":[\"88\"],\"attendence\":{\"88\":\"1\"}}},\"Contractor\":{\"Project Manager\":\"1\",\"Contract Expert\":\"1\",\"D. Project Manager\":\"1\",\"QC\\/Lab Technician\":\"1\",\"Planning Engineer\":\"1\",\"Procurement Engineer \":\"1\",\"Site Engineer\":\"4\",\"Sub Engineer\":\"2\",\"Supervisor\":\"2\",\"Surveyors\":\"1\",\"BBS Expert\":\"1\",\"Architecture Er.\":\"2\",\"Safety Engineer \":\"1\",\"Brickwork Labours\":\"30\",\"Rebar Work Labours\":\"94\",\"Form-work Labours \":\"74\",\"General Skilled Labours\":\"16\",\"General Unskilled Labours\":\"34\"}}', '{\"Total Station\":{\"quantity\":\"1\",\"unit\":\"No\",\"status\":\"1\"},\"Level Machine\":{\"quantity\":\"2\",\"unit\":\"no\",\"status\":\"1\"},\"Excavator\":{\"quantity\":\"2\",\"unit\":\"no\",\"status\":\"1\"},\"Roller\":{\"quantity\":\"1\",\"unit\":\"no\",\"status\":\"2\"},\"Loader\":{\"quantity\":\"1\",\"unit\":\"no\",\"status\":\"1\"},\"Back Hoe Loader\":{\"quantity\":\"1\",\"unit\":\"no\",\"status\":\"1\"},\"Tripper\\/Truck\":{\"quantity\":\"3\",\"unit\":\"no\",\"status\":\"1\"},\"Concrete Mixture\":{\"quantity\":\"3\",\"unit\":\"no\",\"status\":\"1\"},\"Transit Mixture\":{\"quantity\":\"3\",\"unit\":\"no\",\"status\":\"1\"},\"Batching Plant (60m3)\":{\"quantity\":\"1\",\"unit\":\"no\",\"status\":\"1\"},\"Water Browser\":{\"quantity\":\"1\",\"unit\":\"no\",\"status\":\"2\"},\"Service Vehicle\":{\"quantity\":\"3\",\"unit\":\"no\",\"status\":\"1\"},\"Boom Pump\":{\"quantity\":\"1\",\"unit\":\"no\",\"status\":\"1\"},\"Cement Bulker \":{\"quantity\":\"2\",\"unit\":\"no\",\"status\":\"1\"},\"Tower Crane\":{\"quantity\":\"4\",\"unit\":\"no\",\"status\":\"1\"},\"Hydra Crane 25T\":{\"quantity\":\"1\",\"unit\":\"No\",\"status\":\"1\"},\"Pilling Machine\":{\"quantity\":\"1\",\"unit\":\"no\",\"status\":\"2\"},\"Drilling Machine\":{\"quantity\":\"1\",\"unit\":\"no\",\"status\":\"2\"},\"Weighing Bridge \":{\"quantity\":\"1\",\"unit\":\"No\",\"status\":\"2\"},\"Generator \":{\"quantity\":\"1\",\"unit\":\"No\",\"status\":\"2\"},\"Rebar Cutting Machine\":{\"quantity\":\"2\",\"unit\":\"No\",\"status\":\"1\"},\"Rebar draw Machine\":{\"quantity\":\"4\",\"unit\":\"No\",\"status\":\"1\"}}', '{\"OPC Cement\":{\"quantity\":\"\",\"unit\":\"Bags\"},\"Cement\":{\"quantity\":\"2499\",\"unit\":\"Bags\"},\"Sand\":{\"quantity\":\"9793\",\"unit\":\"Cum\"},\"Brick\":{\"quantity\":\"46894\",\"unit\":\"No\"},\"Aggregate\":{\"quantity\":\"15442\",\"unit\":\"Cum\"},\"MS Pipe\":{\"quantity\":\"97\",\"unit\":\"Pcs\"},\"CGI Sheet\":{\"quantity\":\"31\",\"unit\":\"Pcs\"},\"Bentonite\":{\"quantity\":\"360\",\"unit\":\"Bags\"},\"Dust\":{\"quantity\":\"201\",\"unit\":\"Cum\"},\"Base Material\":{\"quantity\":\"401\",\"unit\":\"Cum\"},\"Sub Base Material\":{\"quantity\":\"505\",\"unit\":\"Cum\"},\"Back-filling Soil\":{\"quantity\":\"\",\"unit\":\"Cum\"},\"Reber\":{\"quantity\":\"\",\"unit\":\"Mton\"}}', 'Sunny', '{\"max\":\"\",\"min\":\"\"}', '[\"\"]', '[{\"id\":\"11\",\"block\":\"6\",\"q\":\"\",\"progress\":\"\",\"remarks\":\"Backfilling upto upper tie beam\"},{\"id\":\"21\",\"block\":\"6\",\"q\":\"\",\"progress\":\"\",\"remarks\":\"Brickwork masonry work upto upper tie beam\"},{\"id\":\"19\",\"block\":\"10\",\"q\":\"\",\"progress\":\"\",\"remarks\":\"Laying of formwork in block B\"},{\"id\":\"20\",\"block\":\"10\",\"q\":\"\",\"progress\":\"\",\"remarks\":\"In Block C for Slab, Beam\"},{\"id\":\"20\",\"block\":\"21\",\"q\":\"\",\"progress\":\"\",\"remarks\":\"Rebar work for column and lower tie beam and raft foundation \"},{\"id\":\"19\",\"block\":\"21\",\"q\":\"\",\"progress\":\"\",\"remarks\":\"For Column and shear wall and PCC work\"},{\"id\":\"20\",\"block\":\"20\",\"q\":\"\",\"progress\":\"\",\"remarks\":\"For Lower tie beam and Column and footing \"},{\"id\":\"19\",\"block\":\"20\",\"q\":\"\",\"progress\":\"\",\"remarks\":\"For Lower tie beam and column\"},{\"id\":\"21\",\"block\":\"20\",\"q\":\"\",\"progress\":\"\",\"remarks\":\"Brickwork upto the upper tie beam\"},{\"id\":\"19\",\"block\":\"9\",\"q\":\"\",\"progress\":\"\",\"remarks\":\"Shear wall formwork and laying of formwork for cover slab\"},{\"id\":\"20\",\"block\":\"9\",\"q\":\"\",\"progress\":\"\",\"remarks\":\"At Block A for basement cover slab\"},{\"id\":\"11\",\"block\":\"9\",\"q\":\"\",\"progress\":\"\",\"remarks\":\"Backfilling in shear wall of block A\"},{\"id\":\"13\",\"block\":\"9\",\"q\":\"\",\"progress\":\"\",\"remarks\":\"Spraying Antitermite before backfilling\"},{\"id\":\"18\",\"block\":\"10\",\"q\":\"\",\"progress\":\"\",\"remarks\":\"Concreting of cover slab Block A Slab grid A-E\\/10-12\"},{\"id\":\"4\",\"block\":\"21\",\"q\":\"\",\"progress\":\"\",\"remarks\":\"for raft foundation \"}]', 4, 4, 0, '2020-09-10 08:17:06', '2020-09-13 15:08:32', '[{\"id\":\"10\",\"block\":\"5\",\"sample_code\":\"DUDBC\\/ICB-01\\/253\",\"remarks\":\"Gradation, FI,PI tests\",\"sample_taken_date\":\"2077-05-27\",\"for_client\":[\"80\",\"\"],\"for_contractor\":[\"\"],\"for_consultant\":[\"\"]},{\"id\":\"3\",\"block\":\"5\",\"sample_code\":\"DUDBC\\/ICB-01\\/254\",\"remarks\":\"Gradation and Clay Content Test\",\"sample_taken_date\":\"2077-05-27\",\"for_client\":[\"80\",\"\"],\"for_contractor\":[\"\"],\"for_consultant\":[\"\"]},{\"id\":\"3\",\"block\":\"5\",\"sample_code\":\"DUDBC\\/ICB-01\\/256\",\"remarks\":\"Sand for Mesonry work: Gradation and clay content\",\"sample_taken_date\":\"2077-05-27\",\"for_client\":[\"80\",\"\"],\"for_contractor\":[\"\"],\"for_consultant\":[\"\"]},{\"id\":\"4\",\"block\":\"5\",\"sample_code\":\"DUDBC\\/ICB-01\\/257\",\"remarks\":\"Dimention, water absorption and compressive stregth tests of Gorkha Brick\",\"sample_taken_date\":\"2077-05-26\",\"for_client\":[\"80\",\"\"],\"for_contractor\":[\"\"],\"for_consultant\":[\"\"]}]', ''),
(19, 17091, '2077-05-26', '{\"Client\":{\"Project Chief\":{\"id\":[\"82\"],\"attendence\":{\"82\":\"1\"}},\"Deputy Project Chief\":{\"id\":[\"83\"],\"attendence\":{\"83\":\"1\"}},\"Engineer\":{\"id\":[\"84\",\"85\"],\"attendence\":{\"84\":\"1\",\"85\":\"1\"}},\"Supervisor\":{\"id\":[\"87\"],\"attendence\":{\"87\":\"1\"}},\"Site Supervisor Engineer\":{\"id\":[\"78\",\"79\",\"81\",\"80\"],\"attendence\":{\"78\":\"1\",\"79\":\"1\",\"81\":\"1\",\"80\":\"1\"}},\"Sub Engineer\":{\"id\":[\"88\"],\"attendence\":{\"88\":\"1\"}}},\"Contractor\":{\"Project Manager\":\"1\",\"Contract Expert\":\"1\",\"D. Project Manager\":\"1\",\"QC\\/Lab Technician\":\"1\",\"Planning Engineer\":\"1\",\"Procurement Engineer \":\"1\",\"Site Engineer\":\"6\",\"Sub Engineer\":\"0\",\"Supervisor\":\"2\",\"Surveyors\":\"1\",\"BBS Expert\":\"1\",\"Architecture Er.\":\"2\",\"Safety Engineer \":\"1\",\"Brickwork Labours\":\"30\",\"Rebar Work Labours\":\"94\",\"Form-work Labours \":\"98\",\"General Skilled Labours\":\"16\",\"General Unskilled Labours\":\"34\"}}', '{\"Total Station\":{\"quantity\":\"1\",\"unit\":\"No\",\"status\":\"1\"},\"Level Machine\":{\"quantity\":\"2\",\"unit\":\"no\",\"status\":\"1\"},\"Excavator\":{\"quantity\":\"2\",\"unit\":\"no\",\"status\":\"1\"},\"Roller\":{\"quantity\":\"1\",\"unit\":\"no\",\"status\":\"2\"},\"Loader\":{\"quantity\":\"2\",\"unit\":\"no\",\"status\":\"1\"},\"Back Hoe Loader\":{\"quantity\":\"1\",\"unit\":\"no\",\"status\":\"1\"},\"Tripper\\/Truck\":{\"quantity\":\"3\",\"unit\":\"no\",\"status\":\"1\"},\"Concrete Mixture\":{\"quantity\":\"3\",\"unit\":\"no\",\"status\":\"1\"},\"Transit Mixture\":{\"quantity\":\"3\",\"unit\":\"no\",\"status\":\"1\"},\"Batching Plant (60m3)\":{\"quantity\":\"1\",\"unit\":\"no\",\"status\":\"1\"},\"Water Browser\":{\"quantity\":\"1\",\"unit\":\"no\",\"status\":\"2\"},\"Service Vehicle\":{\"quantity\":\"3\",\"unit\":\"no\",\"status\":\"1\"},\"Boom Pump\":{\"quantity\":\"1\",\"unit\":\"no\",\"status\":\"1\"},\"Cement Bulker \":{\"quantity\":\"2\",\"unit\":\"no\",\"status\":\"1\"},\"Tower Crane\":{\"quantity\":\"4\",\"unit\":\"no\",\"status\":\"1\"},\"Hydra Crane 25T\":{\"quantity\":\"1\",\"unit\":\"No\",\"status\":\"1\"},\"Pilling Machine\":{\"quantity\":\"1\",\"unit\":\"no\",\"status\":\"2\"},\"Drilling Machine\":{\"quantity\":\"1\",\"unit\":\"no\",\"status\":\"2\"},\"Weighing Bridge \":{\"quantity\":\"1\",\"unit\":\"No\",\"status\":\"2\"},\"Generator \":{\"quantity\":\"1\",\"unit\":\"No\",\"status\":\"2\"},\"Rebar Cutting Machine\":{\"quantity\":\"2\",\"unit\":\"No\",\"status\":\"1\"},\"Rebar draw Machine\":{\"quantity\":\"4\",\"unit\":\"No\",\"status\":\"1\"}}', '{\"OPC Cement\":{\"quantity\":\"\",\"unit\":\"Bags\"},\"Cement\":{\"quantity\":\"3759\",\"unit\":\"Bags\"},\"Sand\":{\"quantity\":\"9836\",\"unit\":\"Cum\"},\"Brick\":{\"quantity\":\"43767\",\"unit\":\"No\"},\"Aggregate\":{\"quantity\":\"15525\",\"unit\":\"Cum\"},\"MS Pipe\":{\"quantity\":\"97\",\"unit\":\"Pcs\"},\"CGI Sheet\":{\"quantity\":\"31\",\"unit\":\"Pcs\"},\"Bentonite\":{\"quantity\":\"360\",\"unit\":\"Bags\"},\"Dust\":{\"quantity\":\"201\",\"unit\":\"Cum\"},\"Base Material\":{\"quantity\":\"402\",\"unit\":\"Cum\"},\"Sub Base Material\":{\"quantity\":\"505\",\"unit\":\"Cum\"},\"Back-filling Soil\":{\"quantity\":\"\",\"unit\":\"Cum\"},\"Reber\":{\"quantity\":\"\",\"unit\":\"Mton\"}}', 'Sunny', '{\"max\":\"\",\"min\":\"\"}', '[\"\"]', '[{\"id\":\"11\",\"block\":\"6\",\"q\":\"\",\"progress\":\"\",\"remarks\":\"upto upper tie beam\"},{\"id\":\"21\",\"block\":\"6\",\"q\":\"\",\"progress\":\"\",\"remarks\":\"Upto upper tie beam\"},{\"id\":\"18\",\"block\":\"6\",\"q\":\"\",\"progress\":\"\",\"remarks\":\"Column Grid 13(D-I)\"},{\"id\":\"19\",\"block\":\"10\",\"q\":\"\",\"progress\":\"\",\"remarks\":\"for cover slab, beam and staircase\"},{\"id\":\"20\",\"block\":\"10\",\"q\":\"\",\"progress\":\"\",\"remarks\":\"In Block C for Slab, Beam\"},{\"id\":\"20\",\"block\":\"21\",\"q\":\"\",\"progress\":\"\",\"remarks\":\"for column and lower tie beam\"},{\"id\":\"19\",\"block\":\"21\",\"q\":\"\",\"progress\":\"\",\"remarks\":\"for PCC and lower tie beam\"},{\"id\":\"4\",\"block\":\"21\",\"q\":\"\",\"progress\":\"\",\"remarks\":\"for raft foundation \"},{\"id\":\"11\",\"block\":\"21\",\"q\":\"\",\"progress\":\"\",\"remarks\":\"\"},{\"id\":\"14\",\"block\":\"21\",\"q\":\"\",\"progress\":\"\",\"remarks\":\"for lower tie beam\"},{\"id\":\"20\",\"block\":\"20\",\"q\":\"\",\"progress\":\"\",\"remarks\":\"for lower tie beam, column and footing\"},{\"id\":\"21\",\"block\":\"20\",\"q\":\"\",\"progress\":\"\",\"remarks\":\"upto upper tie beam\"},{\"id\":\"19\",\"block\":\"20\",\"q\":\"\",\"progress\":\"\",\"remarks\":\"for cover slab, column \"},{\"id\":\"19\",\"block\":\"9\",\"q\":\"\",\"progress\":\"\",\"remarks\":\"for cover slab\"},{\"id\":\"20\",\"block\":\"9\",\"q\":\"\",\"progress\":\"\",\"remarks\":\"for cover slab at block A\"}]', 4, 4, 0, '2020-09-13 03:12:21', '2020-09-13 15:03:42', '[{\"id\":\"3\",\"block\":\"5\",\"sample_code\":\"DUDBC\\/ICB-01-248\",\"remarks\":\"gradation and moisture content\",\"sample_taken_date\":\"2077-05-26\",\"for_client\":[\"\",\"80\"],\"for_contractor\":[\"\"],\"for_consultant\":[\"\"]},{\"id\":\"18\",\"block\":\"5\",\"sample_code\":\"DUDBC\\/ICB-01-249\",\"remarks\":\"Gradation and CBR\",\"sample_taken_date\":\"2077-05-26\",\"for_client\":[\"\",\"80\"],\"for_contractor\":[\"\"],\"for_consultant\":[\"\"]},{\"id\":\"1\",\"block\":\"5\",\"sample_code\":\"DUDBC\\/ICB-01\\/250\",\"remarks\":\"Arghakhachi cement: Normal consistency, setting time test, soundness test\",\"sample_taken_date\":\"2077-05-26\",\"for_client\":[\"\",\"80\"],\"for_contractor\":[\"\"],\"for_consultant\":[\"\"]},{\"id\":\"18\",\"block\":\"5\",\"sample_code\":\"DUDBC\\/ICB-01\\/251\",\"remarks\":\"Gradation, MDD,PI and CBR tests\",\"sample_taken_date\":\"2077-05-26\",\"for_client\":[\"\",\"80\"],\"for_contractor\":[\"\"],\"for_consultant\":[\"\"]},{\"id\":\"5\",\"block\":\"5\",\"sample_code\":\"DUDBC\\/ICB-01\\/252\",\"remarks\":\"20 mm Aggt: Gradation,FI, LAA,ACV, Clay lumps Tests\",\"sample_taken_date\":\"2077-05-26\",\"for_client\":[\"\",\"80\"],\"for_contractor\":[\"\"],\"for_consultant\":[\"\"]}]', ''),
(20, 17091, '2077-05-28', '{\"Client\":{\"Project Chief\":{\"id\":[\"82\"],\"attendence\":{\"82\":\"1\"}},\"Deputy Project Chief\":{\"id\":[\"83\"],\"attendence\":{\"83\":\"1\"}},\"Engineer\":{\"id\":[\"84\",\"85\"],\"attendence\":{\"84\":\"1\",\"85\":\"1\"}},\"Supervisor\":{\"id\":[\"87\"],\"attendence\":{\"87\":\"1\"}},\"Site Supervisor Engineer\":{\"id\":[\"78\",\"79\",\"81\",\"80\"],\"attendence\":{\"78\":\"1\",\"79\":\"1\",\"81\":\"1\",\"80\":\"1\"}},\"Sub Engineer\":{\"id\":[\"88\"],\"attendence\":{\"88\":\"1\"}}},\"Contractor\":{\"Project Manager\":\"1\",\"Contract Expert\":\"1\",\"D. Project Manager\":\"1\",\"QC\\/Lab Technician\":\"1\",\"Planning Engineer\":\"1\",\"Procurement Engineer \":\"1\",\"Site Engineer\":\"6\",\"Sub Engineer\":\"0\",\"Supervisor\":\"2\",\"Surveyors\":\"1\",\"BBS Expert\":\"1\",\"Architecture Er.\":\"2\",\"Safety Engineer \":\"1\",\"Brickwork Labours\":\"30\",\"Rebar Work Labours\":\"94\",\"Form-work Labours \":\"98\",\"General Skilled Labours\":\"16\",\"General Unskilled Labours\":\"34\"}}', '{\"Total Station\":{\"quantity\":\"1\",\"unit\":\"No\",\"status\":\"1\"},\"Level Machine\":{\"quantity\":\"2\",\"unit\":\"no\",\"status\":\"1\"},\"Excavator\":{\"quantity\":\"2\",\"unit\":\"no\",\"status\":\"1\"},\"Roller\":{\"quantity\":\"1\",\"unit\":\"no\",\"status\":\"2\"},\"Loader\":{\"quantity\":\"2\",\"unit\":\"no\",\"status\":\"1\"},\"Back Hoe Loader\":{\"quantity\":\"1\",\"unit\":\"no\",\"status\":\"1\"},\"Tripper\\/Truck\":{\"quantity\":\"3\",\"unit\":\"no\",\"status\":\"1\"},\"Concrete Mixture\":{\"quantity\":\"3\",\"unit\":\"no\",\"status\":\"1\"},\"Transit Mixture\":{\"quantity\":\"3\",\"unit\":\"no\",\"status\":\"1\"},\"Batching Plant (60m3)\":{\"quantity\":\"1\",\"unit\":\"no\",\"status\":\"1\"},\"Water Browser\":{\"quantity\":\"1\",\"unit\":\"no\",\"status\":\"2\"},\"Service Vehicle\":{\"quantity\":\"3\",\"unit\":\"no\",\"status\":\"1\"},\"Boom Pump\":{\"quantity\":\"1\",\"unit\":\"no\",\"status\":\"1\"},\"Cement Bulker \":{\"quantity\":\"2\",\"unit\":\"no\",\"status\":\"1\"},\"Tower Crane\":{\"quantity\":\"4\",\"unit\":\"no\",\"status\":\"1\"},\"Hydra Crane 25T\":{\"quantity\":\"1\",\"unit\":\"No\",\"status\":\"1\"},\"Pilling Machine\":{\"quantity\":\"1\",\"unit\":\"no\",\"status\":\"2\"},\"Drilling Machine\":{\"quantity\":\"1\",\"unit\":\"no\",\"status\":\"2\"},\"Weighing Bridge \":{\"quantity\":\"1\",\"unit\":\"No\",\"status\":\"2\"},\"Generator \":{\"quantity\":\"1\",\"unit\":\"No\",\"status\":\"2\"},\"Rebar Cutting Machine\":{\"quantity\":\"2\",\"unit\":\"No\",\"status\":\"1\"},\"Rebar draw Machine\":{\"quantity\":\"4\",\"unit\":\"No\",\"status\":\"1\"}}', '{\"OPC Cement\":{\"quantity\":\"\",\"unit\":\"Bags\"},\"Cement\":{\"quantity\":\"5946\",\"unit\":\"Bags\"},\"Sand\":{\"quantity\":\"9803\",\"unit\":\"Cum\"},\"Brick\":{\"quantity\":\"54894\",\"unit\":\"No\"},\"Aggregate\":{\"quantity\":\"15465\",\"unit\":\"Cum\"},\"MS Pipe\":{\"quantity\":\"97\",\"unit\":\"Pcs\"},\"CGI Sheet\":{\"quantity\":\"31\",\"unit\":\"Pcs\"},\"Bentonite\":{\"quantity\":\"360\",\"unit\":\"Bags\"},\"Dust\":{\"quantity\":\"201\",\"unit\":\"Cum\"},\"Base Material\":{\"quantity\":\"401\",\"unit\":\"Cum\"},\"Sub Base Material\":{\"quantity\":\"505\",\"unit\":\"Cum\"},\"Back-filling Soil\":{\"quantity\":\"\",\"unit\":\"Cum\"},\"Reber\":{\"quantity\":\"\",\"unit\":\"Mton\"}}', 'Sunny', '{\"max\":\"\",\"min\":\"\"}', '[\"\"]', '[{\"id\":\"11\",\"block\":\"6\",\"q\":\"\",\"progress\":\"\",\"remarks\":\"upto upper tie beam\"},{\"id\":\"21\",\"block\":\"6\",\"q\":\"\",\"progress\":\"\",\"remarks\":\"upto upper tie beam\"},{\"id\":\"19\",\"block\":\"10\",\"q\":\"\",\"progress\":\"\",\"remarks\":\"For first floor slab\"},{\"id\":\"20\",\"block\":\"10\",\"q\":\"\",\"progress\":\"\",\"remarks\":\"at block C, first floor slab\"},{\"id\":\"20\",\"block\":\"21\",\"q\":\"\",\"progress\":\"\",\"remarks\":\"for column and raft foundation and lower tie beam\"},{\"id\":\"4\",\"block\":\"21\",\"q\":\"\",\"progress\":\"\",\"remarks\":\"Excavation for foundation\"},{\"id\":\"20\",\"block\":\"20\",\"q\":\"\",\"progress\":\"\",\"remarks\":\"for column\"},{\"id\":\"19\",\"block\":\"20\",\"q\":\"\",\"progress\":\"\",\"remarks\":\"for cover slab\"},{\"id\":\"18\",\"block\":\"20\",\"q\":\"\",\"progress\":\"\",\"remarks\":\"for shear wall of lift and lower tie beam\"},{\"id\":\"20\",\"block\":\"9\",\"q\":\"\",\"progress\":\"\",\"remarks\":\"At Block A for cover slab and beam, column \"},{\"id\":\"19\",\"block\":\"9\",\"q\":\"\",\"progress\":\"\",\"remarks\":\"for cover slab and beam\"},{\"id\":\"18\",\"block\":\"9\",\"q\":\"\",\"progress\":\"\",\"remarks\":\"at linking corridor coulmn and decorative column\"}]', 4, 4, 0, '2020-09-13 03:39:03', '2020-09-14 14:18:17', '[]', ''),
(21, 17091, '2077-05-29', '{\"Client\":{\"Project Chief\":{\"id\":[\"82\"],\"attendence\":{\"82\":\"1\"}},\"Deputy Project Chief\":{\"id\":[\"83\"],\"attendence\":{\"83\":\"1\"}},\"Engineer\":{\"id\":[\"84\",\"85\"],\"attendence\":{\"84\":\"1\",\"85\":\"1\"}},\"Supervisor\":{\"id\":[\"87\"],\"attendence\":{\"87\":\"1\"}},\"Site Supervisor Engineer\":{\"id\":[\"78\",\"79\",\"81\",\"80\"],\"attendence\":{\"78\":\"1\",\"79\":\"1\",\"81\":\"1\",\"80\":\"1\"}},\"Sub Engineer\":{\"id\":[\"88\"],\"attendence\":{\"88\":\"1\"}}},\"Contractor\":{\"Project Manager\":\"1\",\"Contract Expert\":\"1\",\"D. Project Manager\":\"1\",\"QC\\/Lab Technician\":\"1\",\"Planning Engineer\":\"1\",\"Procurement Engineer \":\"1\",\"Site Engineer\":\"6\",\"Sub Engineer\":\"0\",\"Supervisor\":\"2\",\"Surveyors\":\"1\",\"BBS Expert\":\"1\",\"Architecture Er.\":\"2\",\"Safety Engineer \":\"1\",\"Brickwork Labours\":\"30\",\"Rebar Work Labours\":\"94\",\"Form-work Labours \":\"98\",\"General Skilled Labours\":\"16\",\"General Unskilled Labours\":\"34\"}}', '{\"Total Station\":{\"quantity\":\"1\",\"unit\":\"No\",\"status\":\"1\"},\"Level Machine\":{\"quantity\":\"2\",\"unit\":\"no\",\"status\":\"1\"},\"Excavator\":{\"quantity\":\"2\",\"unit\":\"no\",\"status\":\"1\"},\"Roller\":{\"quantity\":\"1\",\"unit\":\"no\",\"status\":\"2\"},\"Loader\":{\"quantity\":\"2\",\"unit\":\"no\",\"status\":\"1\"},\"Back Hoe Loader\":{\"quantity\":\"1\",\"unit\":\"no\",\"status\":\"1\"},\"Tripper\\/Truck\":{\"quantity\":\"3\",\"unit\":\"no\",\"status\":\"1\"},\"Concrete Mixture\":{\"quantity\":\"3\",\"unit\":\"no\",\"status\":\"1\"},\"Transit Mixture\":{\"quantity\":\"3\",\"unit\":\"no\",\"status\":\"1\"},\"Batching Plant (60m3)\":{\"quantity\":\"1\",\"unit\":\"no\",\"status\":\"1\"},\"Water Browser\":{\"quantity\":\"1\",\"unit\":\"no\",\"status\":\"1\"},\"Service Vehicle\":{\"quantity\":\"3\",\"unit\":\"no\",\"status\":\"1\"},\"Boom Pump\":{\"quantity\":\"1\",\"unit\":\"no\",\"status\":\"1\"},\"Cement Bulker \":{\"quantity\":\"2\",\"unit\":\"no\",\"status\":\"1\"},\"Tower Crane\":{\"quantity\":\"4\",\"unit\":\"no\",\"status\":\"1\"},\"Hydra Crane 25T\":{\"quantity\":\"1\",\"unit\":\"No\",\"status\":\"1\"},\"Pilling Machine\":{\"quantity\":\"1\",\"unit\":\"no\",\"status\":\"2\"},\"Drilling Machine\":{\"quantity\":\"1\",\"unit\":\"no\",\"status\":\"2\"},\"Weighing Bridge \":{\"quantity\":\"1\",\"unit\":\"No\",\"status\":\"2\"},\"Generator \":{\"quantity\":\"1\",\"unit\":\"No\",\"status\":\"2\"},\"Rebar Cutting Machine\":{\"quantity\":\"2\",\"unit\":\"No\",\"status\":\"1\"},\"Rebar draw Machine\":{\"quantity\":\"4\",\"unit\":\"No\",\"status\":\"1\"}}', '{\"OPC Cement\":{\"quantity\":\"\",\"unit\":\"Bags\"},\"Cement\":{\"quantity\":\"5674\",\"unit\":\"Bags\"},\"Sand\":{\"quantity\":\"9789\",\"unit\":\"Cum\"},\"Brick\":{\"quantity\":\"57066\",\"unit\":\"No\"},\"Aggregate\":{\"quantity\":\"15450\",\"unit\":\"Cum\"},\"MS Pipe\":{\"quantity\":\"97\",\"unit\":\"Pcs\"},\"CGI Sheet\":{\"quantity\":\"31\",\"unit\":\"Pcs\"},\"Bentonite\":{\"quantity\":\"360\",\"unit\":\"Bags\"},\"Dust\":{\"quantity\":\"201\",\"unit\":\"Cum\"},\"Base Material\":{\"quantity\":\"401\",\"unit\":\"Cum\"},\"Sub Base Material\":{\"quantity\":\"505\",\"unit\":\"Cum\"},\"Back-filling Soil\":{\"quantity\":\"\",\"unit\":\"Cum\"},\"Reber\":{\"quantity\":\"\",\"unit\":\"Mton\"},\"Concrete\":{\"quantity\":\"\",\"unit\":\"Mton\"}}', 'Sunny', '{\"max\":\"\",\"min\":\"\"}', '[\"\"]', '[{\"id\":\"11\",\"block\":\"6\",\"q\":\"\",\"progress\":\"\",\"remarks\":\"Upto Upper Tie beam \"},{\"id\":\"21\",\"block\":\"6\",\"q\":\"\",\"progress\":\"\",\"remarks\":\"Upto upper Tie Beam\"},{\"id\":\"20\",\"block\":\"21\",\"q\":\"\",\"progress\":\"\",\"remarks\":\"For Raft Foundation , column and lower tie beam\"},{\"id\":\"4\",\"block\":\"21\",\"q\":\"\",\"progress\":\"\",\"remarks\":\"For Raft foundation \"},{\"id\":\"21\",\"block\":\"21\",\"q\":\"\",\"progress\":\"\",\"remarks\":\"Upto upper tie beam\"},{\"id\":\"20\",\"block\":\"20\",\"q\":\"\",\"progress\":\"\",\"remarks\":\"For Column\"},{\"id\":\"19\",\"block\":\"20\",\"q\":\"\",\"progress\":\"\",\"remarks\":\"For cover slab, column\"},{\"id\":\"21\",\"block\":\"20\",\"q\":\"\",\"progress\":\"\",\"remarks\":\"Upto upper tie beam\"},{\"id\":\"19\",\"block\":\"9\",\"q\":\"\",\"progress\":\"\",\"remarks\":\"for cover slab and beam \"},{\"id\":\"20\",\"block\":\"9\",\"q\":\"\",\"progress\":\"\",\"remarks\":\"For cover slab and beams \"},{\"id\":\"18\",\"block\":\"9\",\"q\":\"11\",\"progress\":\"\",\"remarks\":\"Column upto first floor\"},{\"id\":\"18\",\"block\":\"21\",\"q\":\"10\",\"progress\":\"\",\"remarks\":\"Column upto upper tie beam\"},{\"id\":\"16\",\"block\":\"21\",\"q\":\"1\",\"progress\":\"\",\"remarks\":\"PCC work for raft foundation \"}]', 4, 4, 0, '2020-09-14 14:04:27', '2020-09-15 11:51:27', '[{\"id\":\"2\",\"block\":\"5\",\"sample_code\":\"DUDBC\\/ICB-01\\/258\",\"remarks\":\"Arghakhachi Cement: Consistency, setting time, soundness tests\",\"sample_taken_date\":\"2077-05-29\",\"for_client\":[\"80\",\"\"],\"for_contractor\":[\"\"],\"for_consultant\":[\"\"]},{\"id\":\"5\",\"block\":\"5\",\"sample_code\":\"DUDBC\\/ICB-01\\/259\",\"remarks\":\"Gradation, FI, ACV, LAA tests\",\"sample_taken_date\":\"2077-05-29\",\"for_client\":[\"80\",\"\"],\"for_contractor\":[\"\"],\"for_consultant\":[\"\"]},{\"id\":\"3\",\"block\":\"5\",\"sample_code\":\"DUDBC\\/ICB-01\\/260\",\"remarks\":\"Gradation and Clay Content Test\",\"sample_taken_date\":\"2077-05-29\",\"for_client\":[\"80\",\"\"],\"for_contractor\":[\"\"],\"for_consultant\":[\"\"]},{\"id\":\"3\",\"block\":\"5\",\"sample_code\":\"DUDBC\\/ICB-01\\/261\",\"remarks\":\"Masonry Sand: Gradation and clay content \",\"sample_taken_date\":\"2077-05-29\",\"for_client\":[\"80\",\"\"],\"for_contractor\":[\"\"],\"for_consultant\":[\"\"]}]', 'Sunny all day'),
(22, 17091, '2077-05-30', '{\"Client\":{\"Project Chief\":{\"id\":[\"82\"],\"attendence\":{\"82\":\"1\"}},\"Deputy Project Chief\":{\"id\":[\"83\"],\"attendence\":{\"83\":\"1\"}},\"Engineer\":{\"id\":[\"84\",\"85\"],\"attendence\":{\"84\":\"1\",\"85\":\"1\"}},\"Supervisor\":{\"id\":[\"87\"],\"attendence\":{\"87\":\"1\"}},\"Site Supervisor Engineer\":{\"id\":[\"78\",\"79\",\"81\",\"80\"],\"attendence\":{\"78\":\"1\",\"79\":\"1\",\"81\":\"1\",\"80\":\"1\"}},\"Sub Engineer\":{\"id\":[\"88\"],\"attendence\":{\"88\":\"1\"}}},\"Contractor\":{\"Project Manager\":\"1\",\"Contract Expert\":\"1\",\"D. Project Manager\":\"1\",\"QC\\/Lab Technician\":\"1\",\"Planning Engineer\":\"1\",\"Procurement Engineer \":\"1\",\"Site Engineer\":\"6\",\"Sub Engineer\":\"0\",\"Supervisor\":\"2\",\"Surveyors\":\"0\",\"BBS Expert\":\"1\",\"Architecture Er.\":\"2\",\"Safety Engineer \":\"1\",\"Brickwork Labours\":\"30\",\"Rebar Work Labours\":\"94\",\"Form-work Labours \":\"98\",\"General Skilled Labours\":\"16\",\"General Unskilled Labours\":\"34\"}}', '{\"Total Station\":{\"quantity\":\"1\",\"unit\":\"No\",\"status\":\"1\"},\"Level Machine\":{\"quantity\":\"2\",\"unit\":\"no\",\"status\":\"1\"},\"Excavator\":{\"quantity\":\"2\",\"unit\":\"no\",\"status\":\"1\"},\"Roller\":{\"quantity\":\"1\",\"unit\":\"no\",\"status\":\"2\"},\"Loader\":{\"quantity\":\"2\",\"unit\":\"no\",\"status\":\"0\"},\"Back Hoe Loader\":{\"quantity\":\"1\",\"unit\":\"no\",\"status\":\"1\"},\"Tripper\\/Truck\":{\"quantity\":\"3\",\"unit\":\"no\",\"status\":\"1\"},\"Concrete Mixture\":{\"quantity\":\"3\",\"unit\":\"no\",\"status\":\"1\"},\"Transit Mixture\":{\"quantity\":\"3\",\"unit\":\"no\",\"status\":\"1\"},\"Batching Plant (60m3)\":{\"quantity\":\"1\",\"unit\":\"no\",\"status\":\"1\"},\"Water Browser\":{\"quantity\":\"1\",\"unit\":\"no\",\"status\":\"2\"},\"Service Vehicle\":{\"quantity\":\"3\",\"unit\":\"no\",\"status\":\"1\"},\"Boom Pump\":{\"quantity\":\"1\",\"unit\":\"no\",\"status\":\"1\"},\"Cement Bulker \":{\"quantity\":\"2\",\"unit\":\"no\",\"status\":\"1\"},\"Tower Crane\":{\"quantity\":\"4\",\"unit\":\"no\",\"status\":\"1\"},\"Hydra Crane 25T\":{\"quantity\":\"1\",\"unit\":\"No\",\"status\":\"1\"},\"Pilling Machine\":{\"quantity\":\"1\",\"unit\":\"no\",\"status\":\"1\"},\"Drilling Machine\":{\"quantity\":\"1\",\"unit\":\"no\",\"status\":\"2\"},\"Weighing Bridge \":{\"quantity\":\"1\",\"unit\":\"No\",\"status\":\"2\"},\"Generator \":{\"quantity\":\"1\",\"unit\":\"No\",\"status\":\"2\"},\"Rebar Cutting Machine\":{\"quantity\":\"2\",\"unit\":\"No\",\"status\":\"1\"},\"Rebar draw Machine\":{\"quantity\":\"4\",\"unit\":\"No\",\"status\":\"1\"}}', '{\"OPC Cement\":{\"quantity\":\"\",\"unit\":\"Bags\"},\"Cement\":{\"quantity\":\"5643\",\"unit\":\"Bags\"},\"Sand\":{\"quantity\":\"9785\",\"unit\":\"Cum\"},\"Brick\":{\"quantity\":\"57086\",\"unit\":\"No\"},\"Aggregate\":{\"quantity\":\"15450\",\"unit\":\"Cum\"},\"MS Pipe\":{\"quantity\":\"97\",\"unit\":\"Pcs\"},\"CGI Sheet\":{\"quantity\":\"31\",\"unit\":\"Pcs\"},\"Bentonite\":{\"quantity\":\"360\",\"unit\":\"Bags\"},\"Dust\":{\"quantity\":\"201\",\"unit\":\"Cum\"},\"Base Material\":{\"quantity\":\"401\",\"unit\":\"Cum\"},\"Sub Base Material\":{\"quantity\":\"505\",\"unit\":\"Cum\"},\"Back-filling Soil\":{\"quantity\":\"\",\"unit\":\"Cum\"},\"Reber\":{\"quantity\":\"\",\"unit\":\"Mton\"},\"Concrete\":{\"quantity\":\"\",\"unit\":\"Mton\"}}', 'Sunny', '{\"max\":\"\",\"min\":\"\"}', '[\"\"]', '[{\"id\":\"11\",\"block\":\"6\",\"q\":\"\",\"progress\":\"\",\"remarks\":\"upto upper tie beam\"},{\"id\":\"21\",\"block\":\"6\",\"q\":\"\",\"progress\":\"\",\"remarks\":\"upto upper tie beam\"},{\"id\":\"19\",\"block\":\"10\",\"q\":\"\",\"progress\":\"\",\"remarks\":\"In Block B for Slab, Beam\"},{\"id\":\"20\",\"block\":\"10\",\"q\":\"\",\"progress\":\"\",\"remarks\":\"In Block C for slab, beam and column lapping\"},{\"id\":\"20\",\"block\":\"21\",\"q\":\"\",\"progress\":\"\",\"remarks\":\"for raft foundation,,lower tie beam\"},{\"id\":\"21\",\"block\":\"21\",\"q\":\"\",\"progress\":\"\",\"remarks\":\"Grid: 12(D-G, 11(H-I) full height, upto upper tie beam\"},{\"id\":\"4\",\"block\":\"21\",\"q\":\"\",\"progress\":\"\",\"remarks\":\"for raft foundation \"},{\"id\":\"7\",\"block\":\"21\",\"q\":\"\",\"progress\":\"\",\"remarks\":\"around the excavated area for raft foundation \"},{\"id\":\"20\",\"block\":\"20\",\"q\":\"\",\"progress\":\"\",\"remarks\":\"for lower tie beam\"},{\"id\":\"19\",\"block\":\"20\",\"q\":\"\",\"progress\":\"\",\"remarks\":\"for cover slab and lower tie beam\"},{\"id\":\"21\",\"block\":\"20\",\"q\":\"\",\"progress\":\"\",\"remarks\":\"Grid: 23(G-H), E(24-25), F(24-25) upto upper tie beam\"},{\"id\":\"11\",\"block\":\"20\",\"q\":\"\",\"progress\":\"\",\"remarks\":\"upto upper tie beam\"},{\"id\":\"20\",\"block\":\"9\",\"q\":\"\",\"progress\":\"\",\"remarks\":\"For basement cover slab and column lapping upto first floor \"},{\"id\":\"19\",\"block\":\"9\",\"q\":\"\",\"progress\":\"\",\"remarks\":\"for cover slab and column upto first floor \"}]', 4, 4, 0, '2020-09-16 04:48:53', '2020-09-16 05:07:35', '[]', ''),
(23, 17091, '2077-05-31', '{\"Client\":{\"Project Chief\":{\"id\":[\"82\"],\"attendence\":{\"82\":\"1\"}},\"Deputy Project Chief\":{\"id\":[\"83\"],\"attendence\":{\"83\":\"1\"}},\"Engineer\":{\"id\":[\"84\",\"85\"],\"attendence\":{\"84\":\"1\",\"85\":\"1\"}},\"Supervisor\":{\"id\":[\"87\"],\"attendence\":{\"87\":\"1\"}},\"Site Supervisor Engineer\":{\"id\":[\"78\",\"79\",\"81\",\"80\"],\"attendence\":{\"78\":\"1\",\"79\":\"1\",\"81\":\"1\",\"80\":\"1\"}},\"Sub Engineer\":{\"id\":[\"88\"],\"attendence\":{\"88\":\"1\"}}},\"Contractor\":{\"Project Manager\":\"1\",\"Contract Expert\":\"1\",\"D. Project Manager\":\"1\",\"QC\\/Lab Technician\":\"1\",\"Planning Engineer\":\"1\",\"Procurement Engineer \":\"1\",\"Site Engineer\":\"6\",\"Sub Engineer\":\"0\",\"Supervisor\":\"2\",\"Surveyors\":\"1\",\"BBS Expert\":\"1\",\"Architecture Er.\":\"2\",\"Safety Engineer \":\"1\",\"Brickwork Labours\":\"30\",\"Rebar Work Labours\":\"94\",\"Form-work Labours \":\"98\",\"General Skilled Labours\":\"16\",\"General Unskilled Labours\":\"34\"}}', '{\"Total Station\":{\"quantity\":\"1\",\"unit\":\"No\",\"status\":\"1\"},\"Level Machine\":{\"quantity\":\"2\",\"unit\":\"no\",\"status\":\"1\"},\"Excavator\":{\"quantity\":\"2\",\"unit\":\"no\",\"status\":\"1\"},\"Roller\":{\"quantity\":\"1\",\"unit\":\"no\",\"status\":\"2\"},\"Loader\":{\"quantity\":\"2\",\"unit\":\"no\",\"status\":\"1\"},\"Back Hoe Loader\":{\"quantity\":\"1\",\"unit\":\"no\",\"status\":\"1\"},\"Tripper\\/Truck\":{\"quantity\":\"3\",\"unit\":\"no\",\"status\":\"1\"},\"Concrete Mixture\":{\"quantity\":\"1\",\"unit\":\"no\",\"status\":\"1\"},\"Transit Mixture\":{\"quantity\":\"3\",\"unit\":\"no\",\"status\":\"1\"},\"Batching Plant (60m3)\":{\"quantity\":\"1\",\"unit\":\"no\",\"status\":\"1\"},\"Water Browser\":{\"quantity\":\"1\",\"unit\":\"no\",\"status\":\"2\"},\"Service Vehicle\":{\"quantity\":\"3\",\"unit\":\"no\",\"status\":\"1\"},\"Boom Pump\":{\"quantity\":\"1\",\"unit\":\"no\",\"status\":\"1\"},\"Cement Bulker \":{\"quantity\":\"2\",\"unit\":\"no\",\"status\":\"1\"},\"Tower Crane\":{\"quantity\":\"4\",\"unit\":\"no\",\"status\":\"1\"},\"Hydra Crane 25T\":{\"quantity\":\"1\",\"unit\":\"No\",\"status\":\"1\"},\"Pilling Machine\":{\"quantity\":\"1\",\"unit\":\"no\",\"status\":\"2\"},\"Drilling Machine\":{\"quantity\":\"1\",\"unit\":\"no\",\"status\":\"2\"},\"Weighing Bridge \":{\"quantity\":\"1\",\"unit\":\"No\",\"status\":\"1\"},\"Generator \":{\"quantity\":\"1\",\"unit\":\"No\",\"status\":\"2\"},\"Rebar Cutting Machine\":{\"quantity\":\"2\",\"unit\":\"No\",\"status\":\"1\"},\"Rebar draw Machine\":{\"quantity\":\"4\",\"unit\":\"No\",\"status\":\"1\"}}', '{\"OPC Cement\":{\"quantity\":\"\",\"unit\":\"Bags\"},\"Cement\":{\"quantity\":\"2974\",\"unit\":\"Bags\"},\"Sand\":{\"quantity\":\"9696\",\"unit\":\"Cum\"},\"Brick\":{\"quantity\":\"50606\",\"unit\":\"No\"},\"Aggregate\":{\"quantity\":\"15272\",\"unit\":\"Cum\"},\"MS Pipe\":{\"quantity\":\"97\",\"unit\":\"Pcs\"},\"CGI Sheet\":{\"quantity\":\"31\",\"unit\":\"Pcs\"},\"Bentonite\":{\"quantity\":\"360\",\"unit\":\"Bags\"},\"Dust\":{\"quantity\":\"201\",\"unit\":\"Cum\"},\"Base Material\":{\"quantity\":\"401\",\"unit\":\"Cum\"},\"Sub Base Material\":{\"quantity\":\"505\",\"unit\":\"Cum\"},\"Back-filling Soil\":{\"quantity\":\"\",\"unit\":\"Cum\"},\"Reber\":{\"quantity\":\"\",\"unit\":\"Mton\"},\"Concrete\":{\"quantity\":\"\",\"unit\":\"Mton\"}}', 'Cloudy', '{\"max\":\"\",\"min\":\"\"}', '[\"\"]', '[{\"id\":\"20\",\"block\":\"9\",\"q\":\"\",\"progress\":\"\",\"remarks\":\"For Basement cover slab, beam and column\"},{\"id\":\"19\",\"block\":\"9\",\"q\":\"\",\"progress\":\"\",\"remarks\":\"For Basement cover slab, beam and column\"},{\"id\":\"11\",\"block\":\"6\",\"q\":\"\",\"progress\":\"\",\"remarks\":\"Upto upper tie beam\"},{\"id\":\"21\",\"block\":\"6\",\"q\":\"\",\"progress\":\"\",\"remarks\":\"Upto upper tie beam\"},{\"id\":\"19\",\"block\":\"10\",\"q\":\"\",\"progress\":\"\",\"remarks\":\"For first floor slab and beam\"},{\"id\":\"20\",\"block\":\"10\",\"q\":\"\",\"progress\":\"\",\"remarks\":\"For first floor slab and beam\"},{\"id\":\"20\",\"block\":\"10\",\"q\":\"\",\"progress\":\"\",\"remarks\":\"Column lapping in Block A\"},{\"id\":\"20\",\"block\":\"21\",\"q\":\"\",\"progress\":\"\",\"remarks\":\"For raft foundation \"},{\"id\":\"4\",\"block\":\"21\",\"q\":\"\",\"progress\":\"\",\"remarks\":\"for raft foundation \"},{\"id\":\"20\",\"block\":\"20\",\"q\":\"\",\"progress\":\"\",\"remarks\":\"for basement cover slab and beam\"},{\"id\":\"19\",\"block\":\"20\",\"q\":\"\",\"progress\":\"\",\"remarks\":\"for basement cover slab and beam\"}]', 4, 4, 0, '2020-09-16 09:15:35', '2020-09-17 06:54:28', '[]', 'No disturbance to work'),
(24, 17091, '2077-06-01', '{\"Client\":{\"Project Chief\":{\"id\":[\"82\"],\"attendence\":{\"82\":\"1\"}},\"Deputy Project Chief\":{\"id\":[\"83\"],\"attendence\":{\"83\":\"1\"}},\"Engineer\":{\"id\":[\"84\",\"85\"],\"attendence\":{\"84\":\"1\",\"85\":\"1\"}},\"Supervisor\":{\"id\":[\"87\"],\"attendence\":{\"87\":\"1\"}},\"Site Supervisor Engineer\":{\"id\":[\"78\",\"79\",\"81\",\"80\"],\"attendence\":{\"78\":\"0\",\"79\":\"1\",\"81\":\"0\",\"80\":\"1\"}},\"Sub Engineer\":{\"id\":[\"88\"],\"attendence\":{\"88\":\"0\"}}},\"Contractor\":{\"Project Manager\":\"1\",\"Contract Expert\":\"1\",\"D. Project Manager\":\"1\",\"QC\\/Lab Technician\":\"1\",\"Planning Engineer\":\"1\",\"Procurement Engineer \":\"1\",\"Site Engineer\":\"6\",\"Sub Engineer\":\"0\",\"Supervisor\":\"2\",\"Surveyors\":\"1\",\"BBS Expert\":\"1\",\"Architecture Er.\":\"2\",\"Safety Engineer \":\"1\",\"Brickwork Labours\":\"0\",\"Rebar Work Labours\":\"0\",\"Form-work Labours \":\"0\",\"General Skilled Labours\":\"0\",\"General Unskilled Labours\":\"0\"}}', '{\"Total Station\":{\"quantity\":\"\",\"unit\":\"No\",\"status\":\"2\"},\"Level Machine\":{\"quantity\":\"\",\"unit\":\"no\",\"status\":\"2\"},\"Excavator\":{\"quantity\":\"\",\"unit\":\"no\",\"status\":\"2\"},\"Roller\":{\"quantity\":\"\",\"unit\":\"no\",\"status\":\"2\"},\"Loader\":{\"quantity\":\"\",\"unit\":\"no\",\"status\":\"2\"},\"Back Hoe Loader\":{\"quantity\":\"\",\"unit\":\"no\",\"status\":\"2\"},\"Tripper\\/Truck\":{\"quantity\":\"\",\"unit\":\"no\",\"status\":\"2\"},\"Concrete Mixture\":{\"quantity\":\"\",\"unit\":\"no\",\"status\":\"2\"},\"Transit Mixture\":{\"quantity\":\"\",\"unit\":\"no\",\"status\":\"2\"},\"Batching Plant (60m3)\":{\"quantity\":\"\",\"unit\":\"no\",\"status\":\"2\"},\"Water Browser\":{\"quantity\":\"\",\"unit\":\"no\",\"status\":\"2\"},\"Service Vehicle\":{\"quantity\":\"\",\"unit\":\"no\",\"status\":\"2\"},\"Boom Pump\":{\"quantity\":\"\",\"unit\":\"no\",\"status\":\"2\"},\"Cement Bulker \":{\"quantity\":\"\",\"unit\":\"no\",\"status\":\"2\"},\"Tower Crane\":{\"quantity\":\"\",\"unit\":\"no\",\"status\":\"1\"},\"Hydra Crane 25T\":{\"quantity\":\"\",\"unit\":\"No\",\"status\":\"2\"},\"Pilling Machine\":{\"quantity\":\"\",\"unit\":\"no\",\"status\":\"2\"},\"Drilling Machine\":{\"quantity\":\"\",\"unit\":\"no\",\"status\":\"2\"},\"Weighing Bridge \":{\"quantity\":\"\",\"unit\":\"No\",\"status\":\"2\"},\"Generator \":{\"quantity\":\"\",\"unit\":\"No\",\"status\":\"2\"},\"Rebar Cutting Machine\":{\"quantity\":\"\",\"unit\":\"No\",\"status\":\"2\"},\"Rebar draw Machine\":{\"quantity\":\"\",\"unit\":\"No\",\"status\":\"2\"}}', '{\"Cement (OPC)\":{\"quantity\":\"\",\"unit\":\"Bags\"},\"Sand\":{\"quantity\":\"9785\",\"unit\":\"Cum\"},\"Brick\":{\"quantity\":\"57086\",\"unit\":\"No\"},\"Aggregate\":{\"quantity\":\"15450\",\"unit\":\"Cum\"},\"MS Pipe\":{\"quantity\":\"97\",\"unit\":\"Pcs\"},\"CGI Sheet\":{\"quantity\":\"31\",\"unit\":\"Pcs\"},\"Bentonite\":{\"quantity\":\"360\",\"unit\":\"Bags\"},\"Dust\":{\"quantity\":\"201\",\"unit\":\"Cum\"},\"Base Material\":{\"quantity\":\"401\",\"unit\":\"Cum\"},\"Sub Base Material\":{\"quantity\":\"505\",\"unit\":\"Cum\"},\"Back-filling Soil\":{\"quantity\":\"\",\"unit\":\"Cum\"},\"Rebar\":{\"quantity\":\"\",\"unit\":\"Mton\"},\"Concrete\":{\"quantity\":\"\",\"unit\":\"CUM\"}}', 'Sunny', '{\"max\":\"\",\"min\":\"\"}', '[\"\"]', '[]', 4, 4, 0, '2020-09-17 06:52:57', '2020-09-18 15:18:45', '[]', 'No work due to Bishwokarma Puja '),
(25, 17091, '2077-06-02', '{\"Client\":{\"Project Chief\":{\"id\":[\"82\"],\"attendence\":{\"82\":\"1\"}},\"Deputy Project Chief\":{\"id\":[\"83\"],\"attendence\":{\"83\":\"1\"}},\"Engineer\":{\"id\":[\"84\",\"85\"],\"attendence\":{\"84\":\"1\",\"85\":\"1\"}},\"Supervisor\":{\"id\":[\"87\"],\"attendence\":{\"87\":\"1\"}},\"Site Supervisor Engineer\":{\"id\":[\"78\",\"79\",\"81\",\"80\"],\"attendence\":{\"78\":\"1\",\"79\":\"1\",\"81\":\"1\",\"80\":\"1\"}},\"Sub Engineer\":{\"id\":[\"88\"],\"attendence\":{\"88\":\"1\"}}},\"Contractor\":{\"Project Manager\":\"1\",\"Contract Expert\":\"1\",\"D. Project Manager\":\"1\",\"QC\\/Lab Technician\":\"1\",\"Planning Engineer\":\"1\",\"Procurement Engineer \":\"1\",\"Site Engineer\":\"6\",\"Sub Engineer\":\"0\",\"Supervisor\":\"2\",\"Surveyors\":\"1\",\"BBS Expert\":\"1\",\"Architecture Er.\":\"2\",\"Safety Engineer \":\"1\",\"Brickwork Labours\":\"30\",\"Rebar Work Labours\":\"94\",\"Form-work Labours \":\"98\",\"General Skilled Labours\":\"16\",\"General Unskilled Labours\":\"34\"}}', '{\"Total Station\":{\"quantity\":\"1\",\"unit\":\"No\",\"status\":\"1\"},\"Level Machine\":{\"quantity\":\"2\",\"unit\":\"no\",\"status\":\"1\"},\"Excavator\":{\"quantity\":\"2\",\"unit\":\"no\",\"status\":\"1\"},\"Roller\":{\"quantity\":\"1\",\"unit\":\"no\",\"status\":\"2\"},\"Loader\":{\"quantity\":\"2\",\"unit\":\"no\",\"status\":\"1\"},\"Back Hoe Loader\":{\"quantity\":\"1\",\"unit\":\"no\",\"status\":\"1\"},\"Tripper\\/Truck\":{\"quantity\":\"3\",\"unit\":\"no\",\"status\":\"1\"},\"Concrete Mixture\":{\"quantity\":\"1\",\"unit\":\"no\",\"status\":\"1\"},\"Transit Mixture\":{\"quantity\":\"3\",\"unit\":\"no\",\"status\":\"1\"},\"Batching Plant (60m3)\":{\"quantity\":\"1\",\"unit\":\"no\",\"status\":\"1\"},\"Water Browser\":{\"quantity\":\"1\",\"unit\":\"no\",\"status\":\"2\"},\"Service Vehicle\":{\"quantity\":\"3\",\"unit\":\"no\",\"status\":\"1\"},\"Boom Pump\":{\"quantity\":\"1\",\"unit\":\"no\",\"status\":\"1\"},\"Cement Bulker \":{\"quantity\":\"2\",\"unit\":\"no\",\"status\":\"1\"},\"Tower Crane\":{\"quantity\":\"4\",\"unit\":\"no\",\"status\":\"1\"},\"Hydra Crane 25T\":{\"quantity\":\"1\",\"unit\":\"No\",\"status\":\"1\"},\"Pilling Machine\":{\"quantity\":\"1\",\"unit\":\"no\",\"status\":\"2\"},\"Drilling Machine\":{\"quantity\":\"1\",\"unit\":\"no\",\"status\":\"2\"},\"Weighing Bridge \":{\"quantity\":\"1\",\"unit\":\"No\",\"status\":\"2\"},\"Generator \":{\"quantity\":\"1\",\"unit\":\"No\",\"status\":\"2\"},\"Rebar Cutting Machine\":{\"quantity\":\"2\",\"unit\":\"No\",\"status\":\"1\"},\"Rebar draw Machine\":{\"quantity\":\"4\",\"unit\":\"No\",\"status\":\"1\"}}', '{\"Cement (OPC)\":{\"quantity\":\"\",\"unit\":\"Bags\"},\"Sand\":{\"quantity\":\"\",\"unit\":\"Cum\"},\"Brick\":{\"quantity\":\"\",\"unit\":\"No\"},\"Aggregate\":{\"quantity\":\"\",\"unit\":\"Cum\"},\"MS Pipe\":{\"quantity\":\"\",\"unit\":\"Pcs\"},\"CGI Sheet\":{\"quantity\":\"\",\"unit\":\"Pcs\"},\"Bentonite\":{\"quantity\":\"\",\"unit\":\"Bags\"},\"Dust\":{\"quantity\":\"\",\"unit\":\"Cum\"},\"Base Material\":{\"quantity\":\"\",\"unit\":\"Cum\"},\"Sub Base Material\":{\"quantity\":\"\",\"unit\":\"Cum\"},\"Back-filling Soil\":{\"quantity\":\"\",\"unit\":\"Cum\"},\"Rebar\":{\"quantity\":\"\",\"unit\":\"Mton\"},\"Concrete\":{\"quantity\":\"\",\"unit\":\"CUM\"}}', 'Sunny', '{\"max\":\"\",\"min\":\"\"}', '[\"\"]', '[{\"id\":\"11\",\"block\":\"6\",\"q\":\"\",\"progress\":\"\",\"remarks\":\"Upto upper tie beam\"},{\"id\":\"21\",\"block\":\"6\",\"q\":\"\",\"progress\":\"\",\"remarks\":\"Upto upper tie beam\"},{\"id\":\"18\",\"block\":\"9\",\"q\":\"13\",\"progress\":\"\",\"remarks\":\"Conreting of coulmn upto first floor \"},{\"id\":\"19\",\"block\":\"10\",\"q\":\"\",\"progress\":\"\",\"remarks\":\"for slab, beam and column\"},{\"id\":\"20\",\"block\":\"10\",\"q\":\"\",\"progress\":\"\",\"remarks\":\"for column upto second floor \"},{\"id\":\"21\",\"block\":\"21\",\"q\":\"\",\"progress\":\"\",\"remarks\":\"Upto upper tie beam\"},{\"id\":\"21\",\"block\":\"20\",\"q\":\"\",\"progress\":\"\",\"remarks\":\"Upto upper tie beam\"},{\"id\":\"20\",\"block\":\"21\",\"q\":\"\",\"progress\":\"\",\"remarks\":\"for raft foundation \"},{\"id\":\"4\",\"block\":\"21\",\"q\":\"\",\"progress\":\"\",\"remarks\":\"for raft foundation \"},{\"id\":\"19\",\"block\":\"20\",\"q\":\"\",\"progress\":\"\",\"remarks\":\"for basement cover slab and beam \"},{\"id\":\"20\",\"block\":\"5\",\"q\":\"\",\"progress\":\"\",\"remarks\":\"for basement cover slab and beam \"}]', 4, 4, 0, '2020-09-18 03:12:54', '2020-09-20 03:12:43', '[{\"id\":\"18\",\"block\":\"5\",\"sample_code\":\"DUDBC\\/ICB-01\\/262\",\"remarks\":\"Backfill Soil: Gradation, MDD, PI,CBR \",\"sample_taken_date\":\"2077-06-02\",\"for_client\":[\"\",\"80\"],\"for_contractor\":[\"\"],\"for_consultant\":[\"\"]},{\"id\":\"4\",\"block\":\"5\",\"sample_code\":\"DUDBC\\/ICB-01\\/263\",\"remarks\":\"Gorkha Brick: Dimension, water absorption and compressive strength tests\",\"sample_taken_date\":\"2077-06-02\",\"for_client\":[\"\",\"80\"],\"for_contractor\":[\"\"],\"for_consultant\":[\"\"]},{\"id\":\"4\",\"block\":\"5\",\"sample_code\":\"DUDBC\\/ICB-01\\/264\",\"remarks\":\"Harisiddhi Brick: Dimension, water absorption and compressive strength tests\",\"sample_taken_date\":\"2077-06-02\",\"for_client\":[\"\",\"80\"],\"for_contractor\":[\"\"],\"for_consultant\":[\"\"]},{\"id\":\"2\",\"block\":\"5\",\"sample_code\":\"DUDBC\\/ICB-01\\/265\",\"remarks\":\"Sarbottam Cement: Compressive strength, normal consistency, setting time and soundness  tests \",\"sample_taken_date\":\"2077-06-02\",\"for_client\":[\"\",\"80\"],\"for_contractor\":[\"\"],\"for_consultant\":[\"\"]}]', ''),
(26, 17091, '2077-06-03', '{\"Client\":{\"Project Chief\":{\"id\":[\"82\"],\"attendence\":{\"82\":\"1\"}},\"Deputy Project Chief\":{\"id\":[\"83\"],\"attendence\":{\"83\":\"1\"}},\"Engineer\":{\"id\":[\"84\",\"85\"],\"attendence\":{\"84\":\"1\",\"85\":\"1\"}},\"Supervisor\":{\"id\":[\"87\"],\"attendence\":{\"87\":\"1\"}},\"Site Supervisor Engineer\":{\"id\":[\"78\",\"79\",\"81\",\"80\"],\"attendence\":{\"78\":\"1\",\"79\":\"1\",\"81\":\"1\",\"80\":\"1\"}},\"Sub Engineer\":{\"id\":[\"88\"],\"attendence\":{\"88\":\"1\"}}},\"Contractor\":{\"Project Manager\":\"1\",\"Contract Expert\":\"1\",\"D. Project Manager\":\"1\",\"QC\\/Lab Technician\":\"1\",\"Planning Engineer\":\"1\",\"Procurement Engineer \":\"1\",\"Site Engineer\":\"6\",\"Sub Engineer\":\"0\",\"Supervisor\":\"2\",\"Surveyors\":\"1\",\"BBS Expert\":\"1\",\"Architecture Er.\":\"2\",\"Safety Engineer \":\"1\",\"Brickwork Labours\":\"30\",\"Rebar Work Labours\":\"94\",\"Form-work Labours \":\"98\",\"General Skilled Labours\":\"16\",\"General Unskilled Labours\":\"30\"}}', '{\"Total Station\":{\"quantity\":\"1\",\"unit\":\"No\",\"status\":\"1\"},\"Level Machine\":{\"quantity\":\"2\",\"unit\":\"no\",\"status\":\"1\"},\"Excavator\":{\"quantity\":\"2\",\"unit\":\"no\",\"status\":\"1\"},\"Roller\":{\"quantity\":\"1\",\"unit\":\"no\",\"status\":\"2\"},\"Loader\":{\"quantity\":\"2\",\"unit\":\"no\",\"status\":\"1\"},\"Back Hoe Loader\":{\"quantity\":\"1\",\"unit\":\"no\",\"status\":\"1\"},\"Tripper\\/Truck\":{\"quantity\":\"3\",\"unit\":\"no\",\"status\":\"1\"},\"Concrete Mixture\":{\"quantity\":\"1\",\"unit\":\"no\",\"status\":\"1\"},\"Transit Mixture\":{\"quantity\":\"3\",\"unit\":\"no\",\"status\":\"1\"},\"Batching Plant (60m3)\":{\"quantity\":\"1\",\"unit\":\"no\",\"status\":\"1\"},\"Water Browser\":{\"quantity\":\"1\",\"unit\":\"no\",\"status\":\"2\"},\"Service Vehicle\":{\"quantity\":\"3\",\"unit\":\"no\",\"status\":\"1\"},\"Boom Pump\":{\"quantity\":\"1\",\"unit\":\"no\",\"status\":\"1\"},\"Cement Bulker \":{\"quantity\":\"2\",\"unit\":\"no\",\"status\":\"1\"},\"Tower Crane\":{\"quantity\":\"4\",\"unit\":\"no\",\"status\":\"1\"},\"Hydra Crane 25T\":{\"quantity\":\"1\",\"unit\":\"No\",\"status\":\"1\"},\"Pilling Machine\":{\"quantity\":\"1\",\"unit\":\"no\",\"status\":\"2\"},\"Drilling Machine\":{\"quantity\":\"1\",\"unit\":\"no\",\"status\":\"2\"},\"Weighing Bridge \":{\"quantity\":\"1\",\"unit\":\"No\",\"status\":\"2\"},\"Generator \":{\"quantity\":\"1\",\"unit\":\"No\",\"status\":\"2\"},\"Rebar Cutting Machine\":{\"quantity\":\"2\",\"unit\":\"No\",\"status\":\"1\"},\"Rebar draw Machine\":{\"quantity\":\"4\",\"unit\":\"No\",\"status\":\"1\"}}', '{\"Cement (OPC)\":{\"quantity\":\"\",\"unit\":\"Bags\"},\"Sand\":{\"quantity\":\"\",\"unit\":\"Cum\"},\"Brick\":{\"quantity\":\"\",\"unit\":\"No\"},\"Aggregate\":{\"quantity\":\"\",\"unit\":\"Cum\"},\"MS Pipe\":{\"quantity\":\"\",\"unit\":\"Pcs\"},\"CGI Sheet\":{\"quantity\":\"\",\"unit\":\"Pcs\"},\"Bentonite\":{\"quantity\":\"\",\"unit\":\"Bags\"},\"Dust\":{\"quantity\":\"\",\"unit\":\"Cum\"},\"Base Material\":{\"quantity\":\"\",\"unit\":\"Cum\"},\"Sub Base Material\":{\"quantity\":\"\",\"unit\":\"Cum\"},\"Back-filling Soil\":{\"quantity\":\"\",\"unit\":\"Cum\"},\"Rebar\":{\"quantity\":\"\",\"unit\":\"Mton\"},\"Concrete\":{\"quantity\":\"\",\"unit\":\"CUM\"}}', 'Sunny', '{\"max\":\"\",\"min\":\"\"}', '[\"\"]', '[]', 4, 4, 0, '2020-09-19 11:44:25', '2020-09-19 11:46:53', '[]', ''),
(27, 17091, '2077-06-07', '{\"Client\":{\"Project Chief\":{\"id\":[\"82\"],\"attendence\":{\"82\":\"1\"}},\"Deputy Project Chief\":{\"id\":[\"83\"],\"attendence\":{\"83\":\"1\"}},\"Engineer\":{\"id\":[\"84\",\"85\"],\"attendence\":{\"84\":\"1\",\"85\":\"1\"}}},\"Contractor\":{\"Project Manager\":\"0\",\"Contract Expert\":\"0\",\"D. Project Manager\":\"0\",\"QC\\/Lab Technician\":\"0\",\"Planning Engineer\":\"0\",\"Procurement Engineer \":\"0\",\"Site Engineer\":\"0\",\"Sub Engineer\":\"0\",\"Supervisor\":\"0\",\"Surveyors\":\"0\",\"BBS Expert\":\"0\",\"Architecture Er.\":\"0\",\"Safety Engineer \":\"0\",\"Brickwork Labours\":\"0\",\"Rebar Work Labours\":\"0\",\"Form-work Labours \":\"0\",\"General Skilled Labours\":\"0\",\"General Unskilled Labours\":\"0\"}}', '{\"Total Station\":{\"quantity\":\"\",\"unit\":\"No\",\"status\":\"0\"},\"Level Machine\":{\"quantity\":\"\",\"unit\":\"no\",\"status\":\"0\"},\"Excavator\":{\"quantity\":\"\",\"unit\":\"no\",\"status\":\"0\"},\"Roller\":{\"quantity\":\"\",\"unit\":\"no\",\"status\":\"0\"},\"Loader\":{\"quantity\":\"\",\"unit\":\"no\",\"status\":\"0\"},\"Back Hoe Loader\":{\"quantity\":\"\",\"unit\":\"no\",\"status\":\"0\"},\"Tripper\\/Truck\":{\"quantity\":\"\",\"unit\":\"no\",\"status\":\"0\"},\"Concrete Mixture\":{\"quantity\":\"\",\"unit\":\"no\",\"status\":\"0\"},\"Transit Mixture\":{\"quantity\":\"\",\"unit\":\"no\",\"status\":\"0\"},\"Batching Plant (60m3)\":{\"quantity\":\"\",\"unit\":\"no\",\"status\":\"0\"},\"Water Browser\":{\"quantity\":\"\",\"unit\":\"no\",\"status\":\"0\"},\"Service Vehicle\":{\"quantity\":\"\",\"unit\":\"no\",\"status\":\"0\"},\"Boom Pump\":{\"quantity\":\"\",\"unit\":\"no\",\"status\":\"0\"},\"Cement Bulker \":{\"quantity\":\"\",\"unit\":\"no\",\"status\":\"0\"},\"Tower Crane\":{\"quantity\":\"\",\"unit\":\"no\",\"status\":\"0\"},\"Hydra Crane 25T\":{\"quantity\":\"\",\"unit\":\"No\",\"status\":\"0\"},\"Pilling Machine\":{\"quantity\":\"\",\"unit\":\"no\",\"status\":\"0\"},\"Drilling Machine\":{\"quantity\":\"\",\"unit\":\"no\",\"status\":\"0\"},\"Weighing Bridge \":{\"quantity\":\"\",\"unit\":\"No\",\"status\":\"0\"},\"Generator \":{\"quantity\":\"\",\"unit\":\"No\",\"status\":\"0\"},\"Rebar Cutting Machine\":{\"quantity\":\"\",\"unit\":\"No\",\"status\":\"0\"},\"Rebar draw Machine\":{\"quantity\":\"\",\"unit\":\"No\",\"status\":\"0\"}}', '{\"Cement (OPC)\":{\"quantity\":\"\",\"unit\":\"Bags\"},\"Sand\":{\"quantity\":\"\",\"unit\":\"Cum\"},\"Brick\":{\"quantity\":\"\",\"unit\":\"No\"},\"Aggregate\":{\"quantity\":\"\",\"unit\":\"Cum\"},\"MS Pipe\":{\"quantity\":\"\",\"unit\":\"Pcs\"},\"CGI Sheet\":{\"quantity\":\"\",\"unit\":\"Pcs\"},\"Bentonite\":{\"quantity\":\"\",\"unit\":\"Bags\"},\"Dust\":{\"quantity\":\"\",\"unit\":\"Cum\"},\"Base Material\":{\"quantity\":\"\",\"unit\":\"Cum\"},\"Sub Base Material\":{\"quantity\":\"\",\"unit\":\"Cum\"},\"Back-filling Soil\":{\"quantity\":\"\",\"unit\":\"Cum\"},\"Rebar\":{\"quantity\":\"\",\"unit\":\"Mton\"},\"Concrete\":{\"quantity\":\"\",\"unit\":\"CUM\"}}', 'Sunny', '{\"max\":\"\",\"min\":\"\"}', '[\"\"]', '[{\"id\":\"3\",\"block\":\"5\",\"q\":\"\",\"progress\":\"\",\"remarks\":\"\"}]', 4, 4, 0, '2020-09-23 00:28:28', '2020-09-23 05:00:13', '[]', '');
INSERT INTO `daily_progresses` (`id`, `project_id`, `date`, `manpower`, `equipments`, `materials`, `weather`, `temperature`, `problems`, `activities`, `created_by`, `updated_by`, `status`, `created_at`, `updated_at`, `samples`, `weather_remarks`) VALUES
(32, 17091, '2077-06-11', NULL, '{\"Total Station\":{\"quantity\":\"\",\"unit\":\"No\",\"status\":\"0\"},\"Level Machine\":{\"quantity\":\"\",\"unit\":\"no\",\"status\":\"0\"},\"Excavator\":{\"quantity\":\"\",\"unit\":\"no\",\"status\":\"0\"},\"Roller\":{\"quantity\":\"\",\"unit\":\"no\",\"status\":\"0\"},\"Loader\":{\"quantity\":\"\",\"unit\":\"no\",\"status\":\"0\"},\"Back Hoe Loader\":{\"quantity\":\"\",\"unit\":\"no\",\"status\":\"0\"},\"Tripper\\/Truck\":{\"quantity\":\"\",\"unit\":\"no\",\"status\":\"0\"},\"Concrete Mixture\":{\"quantity\":\"\",\"unit\":\"no\",\"status\":\"0\"},\"Transit Mixture\":{\"quantity\":\"\",\"unit\":\"no\",\"status\":\"0\"},\"Batching Plant (60m3)\":{\"quantity\":\"\",\"unit\":\"no\",\"status\":\"0\"},\"Water Browser\":{\"quantity\":\"\",\"unit\":\"no\",\"status\":\"0\"},\"Service Vehicle\":{\"quantity\":\"\",\"unit\":\"no\",\"status\":\"0\"},\"Boom Pump\":{\"quantity\":\"\",\"unit\":\"no\",\"status\":\"0\"},\"Cement Bulker \":{\"quantity\":\"\",\"unit\":\"no\",\"status\":\"0\"},\"Tower Crane\":{\"quantity\":\"\",\"unit\":\"no\",\"status\":\"0\"},\"Hydra Crane 25T\":{\"quantity\":\"\",\"unit\":\"No\",\"status\":\"0\"},\"Pilling Machine\":{\"quantity\":\"\",\"unit\":\"no\",\"status\":\"0\"},\"Drilling Machine\":{\"quantity\":\"\",\"unit\":\"no\",\"status\":\"0\"},\"Weighing Bridge \":{\"quantity\":\"\",\"unit\":\"No\",\"status\":\"0\"},\"Generator \":{\"quantity\":\"\",\"unit\":\"No\",\"status\":\"0\"},\"Rebar Cutting Machine\":{\"quantity\":\"\",\"unit\":\"No\",\"status\":\"0\"},\"Rebar draw Machine\":{\"quantity\":\"\",\"unit\":\"No\",\"status\":\"0\"}}', '{\"Cement (OPC)\":{\"quantity\":\"\",\"unit\":\"Bags\"},\"Sand\":{\"quantity\":\"\",\"unit\":\"Cum\"},\"Brick\":{\"quantity\":\"\",\"unit\":\"No\"},\"Aggregate\":{\"quantity\":\"\",\"unit\":\"Cum\"},\"MS Pipe\":{\"quantity\":\"\",\"unit\":\"Pcs\"},\"CGI Sheet\":{\"quantity\":\"\",\"unit\":\"Pcs\"},\"Bentonite\":{\"quantity\":\"\",\"unit\":\"Bags\"},\"Dust\":{\"quantity\":\"\",\"unit\":\"Cum\"},\"Base Material\":{\"quantity\":\"\",\"unit\":\"Cum\"},\"Sub Base Material\":{\"quantity\":\"\",\"unit\":\"Cum\"},\"Back-filling Soil\":{\"quantity\":\"\",\"unit\":\"Cum\"},\"Rebar\":{\"quantity\":\"\",\"unit\":\"Mton\"},\"Concrete\":{\"quantity\":\"\",\"unit\":\"CUM\"}}', 'Sunny', '{\"max\":\"\",\"min\":\"\"}', '[\"\"]', '[]', 3265, 3265, 0, '2020-09-27 06:07:35', '2020-09-27 06:07:35', '[]', ''),
(33, 17091, '2077-06-10', NULL, '{\"Total Station\":{\"quantity\":\"5\",\"unit\":\"No\",\"status\":\"0\"},\"Level Machine\":{\"quantity\":\"3\",\"unit\":\"no\",\"status\":\"0\"},\"Excavator\":{\"quantity\":\"4\",\"unit\":\"no\",\"status\":\"0\"},\"Roller\":{\"quantity\":\"3\",\"unit\":\"no\",\"status\":\"0\"},\"Loader\":{\"quantity\":\"\",\"unit\":\"no\",\"status\":\"0\"},\"Back Hoe Loader\":{\"quantity\":\"\",\"unit\":\"no\",\"status\":\"0\"},\"Tripper\\/Truck\":{\"quantity\":\"\",\"unit\":\"no\",\"status\":\"0\"},\"Concrete Mixture\":{\"quantity\":\"\",\"unit\":\"no\",\"status\":\"0\"},\"Transit Mixture\":{\"quantity\":\"\",\"unit\":\"no\",\"status\":\"0\"},\"Batching Plant (60m3)\":{\"quantity\":\"\",\"unit\":\"no\",\"status\":\"0\"},\"Water Browser\":{\"quantity\":\"\",\"unit\":\"no\",\"status\":\"0\"},\"Service Vehicle\":{\"quantity\":\"\",\"unit\":\"no\",\"status\":\"0\"},\"Boom Pump\":{\"quantity\":\"\",\"unit\":\"no\",\"status\":\"0\"},\"Cement Bulker \":{\"quantity\":\"\",\"unit\":\"no\",\"status\":\"0\"},\"Tower Crane\":{\"quantity\":\"\",\"unit\":\"no\",\"status\":\"0\"},\"Hydra Crane 25T\":{\"quantity\":\"\",\"unit\":\"No\",\"status\":\"0\"},\"Pilling Machine\":{\"quantity\":\"4\",\"unit\":\"no\",\"status\":\"0\"},\"Drilling Machine\":{\"quantity\":\"\",\"unit\":\"no\",\"status\":\"0\"},\"Weighing Bridge \":{\"quantity\":\"\",\"unit\":\"No\",\"status\":\"0\"},\"Generator \":{\"quantity\":\"\",\"unit\":\"No\",\"status\":\"0\"},\"Rebar Cutting Machine\":{\"quantity\":\"\",\"unit\":\"No\",\"status\":\"0\"},\"Rebar draw Machine\":{\"quantity\":\"\",\"unit\":\"No\",\"status\":\"0\"}}', '{\"Cement (OPC)\":{\"quantity\":\"\",\"unit\":\"Bags\"},\"Sand\":{\"quantity\":\"\",\"unit\":\"Cum\"},\"Brick\":{\"quantity\":\"\",\"unit\":\"No\"},\"Aggregate\":{\"quantity\":\"\",\"unit\":\"Cum\"},\"MS Pipe\":{\"quantity\":\"\",\"unit\":\"Pcs\"},\"CGI Sheet\":{\"quantity\":\"\",\"unit\":\"Pcs\"},\"Bentonite\":{\"quantity\":\"\",\"unit\":\"Bags\"},\"Dust\":{\"quantity\":\"\",\"unit\":\"Cum\"},\"Base Material\":{\"quantity\":\"\",\"unit\":\"Cum\"},\"Sub Base Material\":{\"quantity\":\"\",\"unit\":\"Cum\"},\"Back-filling Soil\":{\"quantity\":\"\",\"unit\":\"Cum\"},\"Rebar\":{\"quantity\":\"\",\"unit\":\"Mton\"},\"Concrete\":{\"quantity\":\"\",\"unit\":\"CUM\"}}', 'Sunny', '{\"max\":\"\",\"min\":\"\"}', '[\"\"]', '[]', 3265, 3265, 0, '2020-09-27 06:13:13', '2020-09-27 06:13:13', '[]', ''),
(34, 17091, '2077-06-09', '{\"Client\":{\"project_Clienthuman_resource_title\":{\"id\":[\"id\"]}},\"Consultant\":{\"project_Consultanthuman_resource_title\":{\"id\":[\"id\"]}},\"Contractor\":{\"project_Contractorhuman_resource_title\":{\"id\":[\"id\"]}}}', '{\"Total Station\":{\"quantity\":\"3\",\"unit\":\"No\",\"status\":\"0\"},\"Level Machine\":{\"quantity\":\"5\",\"unit\":\"no\",\"status\":\"0\"},\"Excavator\":{\"quantity\":\"3\",\"unit\":\"no\",\"status\":\"0\"},\"Roller\":{\"quantity\":\"4\",\"unit\":\"no\",\"status\":\"0\"},\"Loader\":{\"quantity\":\"3\",\"unit\":\"no\",\"status\":\"0\"},\"Back Hoe Loader\":{\"quantity\":\"3\",\"unit\":\"no\",\"status\":\"0\"},\"Tripper\\/Truck\":{\"quantity\":\"2\",\"unit\":\"no\",\"status\":\"0\"},\"Concrete Mixture\":{\"quantity\":\"2\",\"unit\":\"no\",\"status\":\"0\"},\"Transit Mixture\":{\"quantity\":\"2\",\"unit\":\"no\",\"status\":\"0\"},\"Batching Plant (60m3)\":{\"quantity\":\"3\",\"unit\":\"no\",\"status\":\"0\"},\"Water Browser\":{\"quantity\":\"2\",\"unit\":\"no\",\"status\":\"0\"},\"Service Vehicle\":{\"quantity\":\"2\",\"unit\":\"no\",\"status\":\"0\"},\"Boom Pump\":{\"quantity\":\"\",\"unit\":\"no\",\"status\":\"0\"},\"Cement Bulker \":{\"quantity\":\"\",\"unit\":\"no\",\"status\":\"0\"},\"Tower Crane\":{\"quantity\":\"\",\"unit\":\"no\",\"status\":\"0\"},\"Hydra Crane 25T\":{\"quantity\":\"\",\"unit\":\"No\",\"status\":\"0\"},\"Pilling Machine\":{\"quantity\":\"\",\"unit\":\"no\",\"status\":\"0\"},\"Drilling Machine\":{\"quantity\":\"\",\"unit\":\"no\",\"status\":\"0\"},\"Weighing Bridge \":{\"quantity\":\"\",\"unit\":\"No\",\"status\":\"0\"},\"Generator \":{\"quantity\":\"\",\"unit\":\"No\",\"status\":\"0\"},\"Rebar Cutting Machine\":{\"quantity\":\"\",\"unit\":\"No\",\"status\":\"0\"},\"Rebar draw Machine\":{\"quantity\":\"\",\"unit\":\"No\",\"status\":\"0\"}}', '{\"Cement (OPC)\":{\"quantity\":\"\",\"unit\":\"Bags\"},\"Sand\":{\"quantity\":\"\",\"unit\":\"Cum\"},\"Brick\":{\"quantity\":\"\",\"unit\":\"No\"},\"Aggregate\":{\"quantity\":\"\",\"unit\":\"Cum\"},\"MS Pipe\":{\"quantity\":\"\",\"unit\":\"Pcs\"},\"CGI Sheet\":{\"quantity\":\"\",\"unit\":\"Pcs\"},\"Bentonite\":{\"quantity\":\"\",\"unit\":\"Bags\"},\"Dust\":{\"quantity\":\"\",\"unit\":\"Cum\"},\"Base Material\":{\"quantity\":\"\",\"unit\":\"Cum\"},\"Sub Base Material\":{\"quantity\":\"\",\"unit\":\"Cum\"},\"Back-filling Soil\":{\"quantity\":\"\",\"unit\":\"Cum\"},\"Rebar\":{\"quantity\":\"\",\"unit\":\"Mton\"},\"Concrete\":{\"quantity\":\"\",\"unit\":\"CUM\"}}', 'Sunny', '{\"max\":\"\",\"min\":\"\"}', '[\"\"]', '[]', 3265, 3265, 0, '2020-09-27 06:19:17', '2020-09-27 06:25:43', '[]', '');

-- --------------------------------------------------------

--
-- Table structure for table `daily_progress_users`
--

CREATE TABLE `daily_progress_users` (
  `id` bigint UNSIGNED NOT NULL,
  `project_id` int UNSIGNED NOT NULL,
  `engineer_id` int UNSIGNED NOT NULL,
  `created_by` int UNSIGNED DEFAULT NULL,
  `updated_by` int UNSIGNED DEFAULT NULL,
  `created_at` timestamp NULL DEFAULT NULL,
  `updated_at` timestamp NULL DEFAULT NULL
) ENGINE=InnoDB DEFAULT CHARSET=utf8 COLLATE=utf8_unicode_ci;

-- --------------------------------------------------------

--
-- Table structure for table `datecon`
--

CREATE TABLE `datecon` (
  `sn` int NOT NULL,
  `dateeng` varchar(20) NOT NULL,
  `datenep` varchar(20) NOT NULL,
  `datenepformatted` varchar(20) NOT NULL,
  `monthname` varchar(20) NOT NULL,
  `year` int NOT NULL,
  `mt` int NOT NULL,
  `day` int NOT NULL,
  `weekday` int NOT NULL
) ENGINE=MyISAM DEFAULT CHARSET=latin1;

--
-- Dumping data for table `datecon`
--

INSERT INTO `datecon` (`sn`, `dateeng`, `datenep`, `datenepformatted`, `monthname`, `year`, `mt`, `day`, `weekday`) VALUES
(24109, '2009-04-14', '01/01/2066', '2066-01-01', 'Baishakh', 2066, 1, 1, 3),
(24110, '2009-04-15', '02/01/2066', '2066-01-02', 'Baishakh', 2066, 1, 2, 4),
(24111, '2009-04-16', '03/01/2066', '2066-01-03', 'Baishakh', 2066, 1, 3, 5),
(24112, '2009-04-17', '04/01/2066', '2066-01-04', 'Baishakh', 2066, 1, 4, 6),
(24113, '2009-04-18', '05/01/2066', '2066-01-05', 'Baishakh', 2066, 1, 5, 7),
(24114, '2009-04-19', '06/01/2066', '2066-01-06', 'Baishakh', 2066, 1, 6, 1),
(24115, '2009-04-20', '07/01/2066', '2066-01-07', 'Baishakh', 2066, 1, 7, 2),
(24116, '2009-04-21', '08/01/2066', '2066-01-08', 'Baishakh', 2066, 1, 8, 3),
(24117, '2009-04-22', '09/01/2066', '2066-01-09', 'Baishakh', 2066, 1, 9, 4),
(24118, '2009-04-23', '10/01/2066', '2066-01-10', 'Baishakh', 2066, 1, 10, 5),
(24119, '2009-04-24', '11/01/2066', '2066-01-11', 'Baishakh', 2066, 1, 11, 6),
(24120, '2009-04-25', '12/01/2066', '2066-01-12', 'Baishakh', 2066, 1, 12, 7),
(24121, '2009-04-26', '13/01/2066', '2066-01-13', 'Baishakh', 2066, 1, 13, 1),
(24122, '2009-04-27', '14/01/2066', '2066-01-14', 'Baishakh', 2066, 1, 14, 2),
(24123, '2009-04-28', '15/01/2066', '2066-01-15', 'Baishakh', 2066, 1, 15, 3),
(24124, '2009-04-29', '16/01/2066', '2066-01-16', 'Baishakh', 2066, 1, 16, 4),
(24125, '2009-04-30', '17/01/2066', '2066-01-17', 'Baishakh', 2066, 1, 17, 5),
(24126, '2009-05-01', '18/01/2066', '2066-01-18', 'Baishakh', 2066, 1, 18, 6),
(24127, '2009-05-02', '19/01/2066', '2066-01-19', 'Baishakh', 2066, 1, 19, 7),
(24128, '2009-05-03', '20/01/2066', '2066-01-20', 'Baishakh', 2066, 1, 20, 1),
(24129, '2009-05-04', '21/01/2066', '2066-01-21', 'Baishakh', 2066, 1, 21, 2),
(24130, '2009-05-05', '22/01/2066', '2066-01-22', 'Baishakh', 2066, 1, 22, 3),
(24131, '2009-05-06', '23/01/2066', '2066-01-23', 'Baishakh', 2066, 1, 23, 4),
(24132, '2009-05-07', '24/01/2066', '2066-01-24', 'Baishakh', 2066, 1, 24, 5),
(24133, '2009-05-08', '25/01/2066', '2066-01-25', 'Baishakh', 2066, 1, 25, 6),
(24134, '2009-05-09', '26/01/2066', '2066-01-26', 'Baishakh', 2066, 1, 26, 7),
(24135, '2009-05-10', '27/01/2066', '2066-01-27', 'Baishakh', 2066, 1, 27, 1),
(24136, '2009-05-11', '28/01/2066', '2066-01-28', 'Baishakh', 2066, 1, 28, 2),
(24137, '2009-05-12', '29/01/2066', '2066-01-29', 'Baishakh', 2066, 1, 29, 3),
(24138, '2009-05-13', '30/01/2066', '2066-01-30', 'Baishakh', 2066, 1, 30, 4),
(24139, '2009-05-14', '31/01/2066', '2066-01-31', 'Baishakh', 2066, 1, 31, 5),
(24140, '2009-05-15', '01/02/2066', '2066-02-01', 'Jestha', 2066, 2, 1, 6),
(24141, '2009-05-16', '02/02/2066', '2066-02-02', 'Jestha', 2066, 2, 2, 7),
(24142, '2009-05-17', '03/02/2066', '2066-02-03', 'Jestha', 2066, 2, 3, 1),
(24143, '2009-05-18', '04/02/2066', '2066-02-04', 'Jestha', 2066, 2, 4, 2),
(24144, '2009-05-19', '05/02/2066', '2066-02-05', 'Jestha', 2066, 2, 5, 3),
(24145, '2009-05-20', '06/02/2066', '2066-02-06', 'Jestha', 2066, 2, 6, 4),
(24146, '2009-05-21', '07/02/2066', '2066-02-07', 'Jestha', 2066, 2, 7, 5),
(24147, '2009-05-22', '08/02/2066', '2066-02-08', 'Jestha', 2066, 2, 8, 6),
(24148, '2009-05-23', '09/02/2066', '2066-02-09', 'Jestha', 2066, 2, 9, 7),
(24149, '2009-05-24', '10/02/2066', '2066-02-10', 'Jestha', 2066, 2, 10, 1),
(24150, '2009-05-25', '11/02/2066', '2066-02-11', 'Jestha', 2066, 2, 11, 2),
(24151, '2009-05-26', '12/02/2066', '2066-02-12', 'Jestha', 2066, 2, 12, 3),
(24152, '2009-05-27', '13/02/2066', '2066-02-13', 'Jestha', 2066, 2, 13, 4),
(24153, '2009-05-28', '14/02/2066', '2066-02-14', 'Jestha', 2066, 2, 14, 5),
(24154, '2009-05-29', '15/02/2066', '2066-02-15', 'Jestha', 2066, 2, 15, 6),
(24155, '2009-05-30', '16/02/2066', '2066-02-16', 'Jestha', 2066, 2, 16, 7),
(24156, '2009-05-31', '17/02/2066', '2066-02-17', 'Jestha', 2066, 2, 17, 1),
(24157, '2009-06-01', '18/02/2066', '2066-02-18', 'Jestha', 2066, 2, 18, 2),
(24158, '2009-06-02', '19/02/2066', '2066-02-19', 'Jestha', 2066, 2, 19, 3),
(24159, '2009-06-03', '20/02/2066', '2066-02-20', 'Jestha', 2066, 2, 20, 4),
(24160, '2009-06-04', '21/02/2066', '2066-02-21', 'Jestha', 2066, 2, 21, 5),
(24161, '2009-06-05', '22/02/2066', '2066-02-22', 'Jestha', 2066, 2, 22, 6),
(24162, '2009-06-06', '23/02/2066', '2066-02-23', 'Jestha', 2066, 2, 23, 7),
(24163, '2009-06-07', '24/02/2066', '2066-02-24', 'Jestha', 2066, 2, 24, 1),
(24164, '2009-06-08', '25/02/2066', '2066-02-25', 'Jestha', 2066, 2, 25, 2),
(24165, '2009-06-09', '26/02/2066', '2066-02-26', 'Jestha', 2066, 2, 26, 3),
(24166, '2009-06-10', '27/02/2066', '2066-02-27', 'Jestha', 2066, 2, 27, 4),
(24167, '2009-06-11', '28/02/2066', '2066-02-28', 'Jestha', 2066, 2, 28, 5),
(24168, '2009-06-12', '29/02/2066', '2066-02-29', 'Jestha', 2066, 2, 29, 6),
(24169, '2009-06-13', '30/02/2066', '2066-02-30', 'Jestha', 2066, 2, 30, 7),
(24170, '2009-06-14', '31/02/2066', '2066-02-31', 'Jestha', 2066, 2, 31, 1),
(24171, '2009-06-15', '01/03/2066', '2066-03-01', 'Ashadh', 2066, 3, 1, 2),
(24172, '2009-06-16', '02/03/2066', '2066-03-02', 'Ashadh', 2066, 3, 2, 3),
(24173, '2009-06-17', '03/03/2066', '2066-03-03', 'Ashadh', 2066, 3, 3, 4),
(24174, '2009-06-18', '04/03/2066', '2066-03-04', 'Ashadh', 2066, 3, 4, 5),
(24175, '2009-06-19', '05/03/2066', '2066-03-05', 'Ashadh', 2066, 3, 5, 6),
(24176, '2009-06-20', '06/03/2066', '2066-03-06', 'Ashadh', 2066, 3, 6, 7),
(24177, '2009-06-21', '07/03/2066', '2066-03-07', 'Ashadh', 2066, 3, 7, 1),
(24178, '2009-06-22', '08/03/2066', '2066-03-08', 'Ashadh', 2066, 3, 8, 2),
(24179, '2009-06-23', '09/03/2066', '2066-03-09', 'Ashadh', 2066, 3, 9, 3),
(24180, '2009-06-24', '10/03/2066', '2066-03-10', 'Ashadh', 2066, 3, 10, 4),
(24181, '2009-06-25', '11/03/2066', '2066-03-11', 'Ashadh', 2066, 3, 11, 5),
(24182, '2009-06-26', '12/03/2066', '2066-03-12', 'Ashadh', 2066, 3, 12, 6),
(24183, '2009-06-27', '13/03/2066', '2066-03-13', 'Ashadh', 2066, 3, 13, 7),
(24184, '2009-06-28', '14/03/2066', '2066-03-14', 'Ashadh', 2066, 3, 14, 1),
(24185, '2009-06-29', '15/03/2066', '2066-03-15', 'Ashadh', 2066, 3, 15, 2),
(24186, '2009-06-30', '16/03/2066', '2066-03-16', 'Ashadh', 2066, 3, 16, 3),
(24187, '2009-07-01', '17/03/2066', '2066-03-17', 'Ashadh', 2066, 3, 17, 4),
(24188, '2009-07-02', '18/03/2066', '2066-03-18', 'Ashadh', 2066, 3, 18, 5),
(24189, '2009-07-03', '19/03/2066', '2066-03-19', 'Ashadh', 2066, 3, 19, 6),
(24190, '2009-07-04', '20/03/2066', '2066-03-20', 'Ashadh', 2066, 3, 20, 7),
(24191, '2009-07-05', '21/03/2066', '2066-03-21', 'Ashadh', 2066, 3, 21, 1),
(24192, '2009-07-06', '22/03/2066', '2066-03-22', 'Ashadh', 2066, 3, 22, 2),
(24193, '2009-07-07', '23/03/2066', '2066-03-23', 'Ashadh', 2066, 3, 23, 3),
(24194, '2009-07-08', '24/03/2066', '2066-03-24', 'Ashadh', 2066, 3, 24, 4),
(24195, '2009-07-09', '25/03/2066', '2066-03-25', 'Ashadh', 2066, 3, 25, 5),
(24196, '2009-07-10', '26/03/2066', '2066-03-26', 'Ashadh', 2066, 3, 26, 6),
(24197, '2009-07-11', '27/03/2066', '2066-03-27', 'Ashadh', 2066, 3, 27, 7),
(24198, '2009-07-12', '28/03/2066', '2066-03-28', 'Ashadh', 2066, 3, 28, 1),
(24199, '2009-07-13', '29/03/2066', '2066-03-29', 'Ashadh', 2066, 3, 29, 2),
(24200, '2009-07-14', '30/03/2066', '2066-03-30', 'Ashadh', 2066, 3, 30, 3),
(24201, '2009-07-15', '31/03/2066', '2066-03-31', 'Ashadh', 2066, 3, 31, 4),
(24202, '2009-07-16', '01/04/2066', '2066-04-01', 'Shrawan', 2066, 4, 1, 5),
(24203, '2009-07-17', '02/04/2066', '2066-04-02', 'Shrawan', 2066, 4, 2, 6),
(24204, '2009-07-18', '03/04/2066', '2066-04-03', 'Shrawan', 2066, 4, 3, 7),
(24205, '2009-07-19', '04/04/2066', '2066-04-04', 'Shrawan', 2066, 4, 4, 1),
(24206, '2009-07-20', '05/04/2066', '2066-04-05', 'Shrawan', 2066, 4, 5, 2),
(24207, '2009-07-21', '06/04/2066', '2066-04-06', 'Shrawan', 2066, 4, 6, 3),
(24208, '2009-07-22', '07/04/2066', '2066-04-07', 'Shrawan', 2066, 4, 7, 4),
(24209, '2009-07-23', '08/04/2066', '2066-04-08', 'Shrawan', 2066, 4, 8, 5),
(24210, '2009-07-24', '09/04/2066', '2066-04-09', 'Shrawan', 2066, 4, 9, 6),
(24211, '2009-07-25', '10/04/2066', '2066-04-10', 'Shrawan', 2066, 4, 10, 7),
(24212, '2009-07-26', '11/04/2066', '2066-04-11', 'Shrawan', 2066, 4, 11, 1),
(24213, '2009-07-27', '12/04/2066', '2066-04-12', 'Shrawan', 2066, 4, 12, 2),
(24214, '2009-07-28', '13/04/2066', '2066-04-13', 'Shrawan', 2066, 4, 13, 3),
(24215, '2009-07-29', '14/04/2066', '2066-04-14', 'Shrawan', 2066, 4, 14, 4),
(24216, '2009-07-30', '15/04/2066', '2066-04-15', 'Shrawan', 2066, 4, 15, 5),
(24217, '2009-07-31', '16/04/2066', '2066-04-16', 'Shrawan', 2066, 4, 16, 6),
(24218, '2009-08-01', '17/04/2066', '2066-04-17', 'Shrawan', 2066, 4, 17, 7),
(24219, '2009-08-02', '18/04/2066', '2066-04-18', 'Shrawan', 2066, 4, 18, 1),
(24220, '2009-08-03', '19/04/2066', '2066-04-19', 'Shrawan', 2066, 4, 19, 2),
(24221, '2009-08-04', '20/04/2066', '2066-04-20', 'Shrawan', 2066, 4, 20, 3),
(24222, '2009-08-05', '21/04/2066', '2066-04-21', 'Shrawan', 2066, 4, 21, 4),
(24223, '2009-08-06', '22/04/2066', '2066-04-22', 'Shrawan', 2066, 4, 22, 5),
(24224, '2009-08-07', '23/04/2066', '2066-04-23', 'Shrawan', 2066, 4, 23, 6),
(24225, '2009-08-08', '24/04/2066', '2066-04-24', 'Shrawan', 2066, 4, 24, 7),
(24226, '2009-08-09', '25/04/2066', '2066-04-25', 'Shrawan', 2066, 4, 25, 1),
(24227, '2009-08-10', '26/04/2066', '2066-04-26', 'Shrawan', 2066, 4, 26, 2),
(24228, '2009-08-11', '27/04/2066', '2066-04-27', 'Shrawan', 2066, 4, 27, 3),
(24229, '2009-08-12', '28/04/2066', '2066-04-28', 'Shrawan', 2066, 4, 28, 4),
(24230, '2009-08-13', '29/04/2066', '2066-04-29', 'Shrawan', 2066, 4, 29, 5),
(24231, '2009-08-14', '30/04/2066', '2066-04-30', 'Shrawan', 2066, 4, 30, 6),
(24232, '2009-08-15', '31/04/2066', '2066-04-31', 'Shrawan', 2066, 4, 31, 7),
(24233, '2009-08-16', '32/04/2066', '2066-04-32', 'Shrawan', 2066, 4, 32, 1),
(24234, '2009-08-17', '01/05/2066', '2066-05-01', 'Bhadra', 2066, 5, 1, 2),
(24235, '2009-08-18', '02/05/2066', '2066-05-02', 'Bhadra', 2066, 5, 2, 3),
(24236, '2009-08-19', '03/05/2066', '2066-05-03', 'Bhadra', 2066, 5, 3, 4),
(24237, '2009-08-20', '04/05/2066', '2066-05-04', 'Bhadra', 2066, 5, 4, 5),
(24238, '2009-08-21', '05/05/2066', '2066-05-05', 'Bhadra', 2066, 5, 5, 6),
(24239, '2009-08-22', '06/05/2066', '2066-05-06', 'Bhadra', 2066, 5, 6, 7),
(24240, '2009-08-23', '07/05/2066', '2066-05-07', 'Bhadra', 2066, 5, 7, 1),
(24241, '2009-08-24', '08/05/2066', '2066-05-08', 'Bhadra', 2066, 5, 8, 2),
(24242, '2009-08-25', '09/05/2066', '2066-05-09', 'Bhadra', 2066, 5, 9, 3),
(24243, '2009-08-26', '10/05/2066', '2066-05-10', 'Bhadra', 2066, 5, 10, 4),
(24244, '2009-08-27', '11/05/2066', '2066-05-11', 'Bhadra', 2066, 5, 11, 5),
(24245, '2009-08-28', '12/05/2066', '2066-05-12', 'Bhadra', 2066, 5, 12, 6),
(24246, '2009-08-29', '13/05/2066', '2066-05-13', 'Bhadra', 2066, 5, 13, 7),
(24247, '2009-08-30', '14/05/2066', '2066-05-14', 'Bhadra', 2066, 5, 14, 1),
(24248, '2009-08-31', '15/05/2066', '2066-05-15', 'Bhadra', 2066, 5, 15, 2),
(24249, '2009-09-01', '16/05/2066', '2066-05-16', 'Bhadra', 2066, 5, 16, 3),
(24250, '2009-09-02', '17/05/2066', '2066-05-17', 'Bhadra', 2066, 5, 17, 4),
(24251, '2009-09-03', '18/05/2066', '2066-05-18', 'Bhadra', 2066, 5, 18, 5),
(24252, '2009-09-04', '19/05/2066', '2066-05-19', 'Bhadra', 2066, 5, 19, 6),
(24253, '2009-09-05', '20/05/2066', '2066-05-20', 'Bhadra', 2066, 5, 20, 7),
(24254, '2009-09-06', '21/05/2066', '2066-05-21', 'Bhadra', 2066, 5, 21, 1),
(24255, '2009-09-07', '22/05/2066', '2066-05-22', 'Bhadra', 2066, 5, 22, 2),
(24256, '2009-09-08', '23/05/2066', '2066-05-23', 'Bhadra', 2066, 5, 23, 3),
(24257, '2009-09-09', '24/05/2066', '2066-05-24', 'Bhadra', 2066, 5, 24, 4),
(24258, '2009-09-10', '25/05/2066', '2066-05-25', 'Bhadra', 2066, 5, 25, 5),
(24259, '2009-09-11', '26/05/2066', '2066-05-26', 'Bhadra', 2066, 5, 26, 6),
(24260, '2009-09-12', '27/05/2066', '2066-05-27', 'Bhadra', 2066, 5, 27, 7),
(24261, '2009-09-13', '28/05/2066', '2066-05-28', 'Bhadra', 2066, 5, 28, 1),
(24262, '2009-09-14', '29/05/2066', '2066-05-29', 'Bhadra', 2066, 5, 29, 2),
(24263, '2009-09-15', '30/05/2066', '2066-05-30', 'Bhadra', 2066, 5, 30, 3),
(24264, '2009-09-16', '31/05/2066', '2066-05-31', 'Bhadra', 2066, 5, 31, 4),
(24265, '2009-09-17', '01/06/2066', '2066-06-01', 'Ashwin', 2066, 6, 1, 5),
(24266, '2009-09-18', '02/06/2066', '2066-06-02', 'Ashwin', 2066, 6, 2, 6),
(24267, '2009-09-19', '03/06/2066', '2066-06-03', 'Ashwin', 2066, 6, 3, 7),
(24268, '2009-09-20', '04/06/2066', '2066-06-04', 'Ashwin', 2066, 6, 4, 1),
(24269, '2009-09-21', '05/06/2066', '2066-06-05', 'Ashwin', 2066, 6, 5, 2),
(24270, '2009-09-22', '06/06/2066', '2066-06-06', 'Ashwin', 2066, 6, 6, 3),
(24271, '2009-09-23', '07/06/2066', '2066-06-07', 'Ashwin', 2066, 6, 7, 4),
(24272, '2009-09-24', '08/06/2066', '2066-06-08', 'Ashwin', 2066, 6, 8, 5),
(24273, '2009-09-25', '09/06/2066', '2066-06-09', 'Ashwin', 2066, 6, 9, 6),
(24274, '2009-09-26', '10/06/2066', '2066-06-10', 'Ashwin', 2066, 6, 10, 7),
(24275, '2009-09-27', '11/06/2066', '2066-06-11', 'Ashwin', 2066, 6, 11, 1),
(24276, '2009-09-28', '12/06/2066', '2066-06-12', 'Ashwin', 2066, 6, 12, 2),
(24277, '2009-09-29', '13/06/2066', '2066-06-13', 'Ashwin', 2066, 6, 13, 3),
(24278, '2009-09-30', '14/06/2066', '2066-06-14', 'Ashwin', 2066, 6, 14, 4),
(24279, '2009-10-01', '15/06/2066', '2066-06-15', 'Ashwin', 2066, 6, 15, 5),
(24280, '2009-10-02', '16/06/2066', '2066-06-16', 'Ashwin', 2066, 6, 16, 6),
(24281, '2009-10-03', '17/06/2066', '2066-06-17', 'Ashwin', 2066, 6, 17, 7),
(24282, '2009-10-04', '18/06/2066', '2066-06-18', 'Ashwin', 2066, 6, 18, 1),
(24283, '2009-10-05', '19/06/2066', '2066-06-19', 'Ashwin', 2066, 6, 19, 2),
(24284, '2009-10-06', '20/06/2066', '2066-06-20', 'Ashwin', 2066, 6, 20, 3),
(24285, '2009-10-07', '21/06/2066', '2066-06-21', 'Ashwin', 2066, 6, 21, 4),
(24286, '2009-10-08', '22/06/2066', '2066-06-22', 'Ashwin', 2066, 6, 22, 5),
(24287, '2009-10-09', '23/06/2066', '2066-06-23', 'Ashwin', 2066, 6, 23, 6),
(24288, '2009-10-10', '24/06/2066', '2066-06-24', 'Ashwin', 2066, 6, 24, 7),
(24289, '2009-10-11', '25/06/2066', '2066-06-25', 'Ashwin', 2066, 6, 25, 1),
(24290, '2009-10-12', '26/06/2066', '2066-06-26', 'Ashwin', 2066, 6, 26, 2),
(24291, '2009-10-13', '27/06/2066', '2066-06-27', 'Ashwin', 2066, 6, 27, 3),
(24292, '2009-10-14', '28/06/2066', '2066-06-28', 'Ashwin', 2066, 6, 28, 4),
(24293, '2009-10-15', '29/06/2066', '2066-06-29', 'Ashwin', 2066, 6, 29, 5),
(24294, '2009-10-16', '30/06/2066', '2066-06-30', 'Ashwin', 2066, 6, 30, 6),
(24295, '2009-10-17', '31/06/2066', '2066-06-31', 'Ashwin', 2066, 6, 31, 7),
(24296, '2009-10-18', '01/07/2066', '2066-07-01', 'Kartik', 2066, 7, 1, 1),
(24297, '2009-10-19', '02/07/2066', '2066-07-02', 'Kartik', 2066, 7, 2, 2),
(24298, '2009-10-20', '03/07/2066', '2066-07-03', 'Kartik', 2066, 7, 3, 3),
(24299, '2009-10-21', '04/07/2066', '2066-07-04', 'Kartik', 2066, 7, 4, 4),
(24300, '2009-10-22', '05/07/2066', '2066-07-05', 'Kartik', 2066, 7, 5, 5),
(24301, '2009-10-23', '06/07/2066', '2066-07-06', 'Kartik', 2066, 7, 6, 6),
(24302, '2009-10-24', '07/07/2066', '2066-07-07', 'Kartik', 2066, 7, 7, 7),
(24303, '2009-10-25', '08/07/2066', '2066-07-08', 'Kartik', 2066, 7, 8, 1),
(24304, '2009-10-26', '09/07/2066', '2066-07-09', 'Kartik', 2066, 7, 9, 2),
(24305, '2009-10-27', '10/07/2066', '2066-07-10', 'Kartik', 2066, 7, 10, 3),
(24306, '2009-10-28', '11/07/2066', '2066-07-11', 'Kartik', 2066, 7, 11, 4),
(24307, '2009-10-29', '12/07/2066', '2066-07-12', 'Kartik', 2066, 7, 12, 5),
(24308, '2009-10-30', '13/07/2066', '2066-07-13', 'Kartik', 2066, 7, 13, 6),
(24309, '2009-10-31', '14/07/2066', '2066-07-14', 'Kartik', 2066, 7, 14, 7),
(24310, '2009-11-01', '15/07/2066', '2066-07-15', 'Kartik', 2066, 7, 15, 1),
(24311, '2009-11-02', '16/07/2066', '2066-07-16', 'Kartik', 2066, 7, 16, 2),
(24312, '2009-11-03', '17/07/2066', '2066-07-17', 'Kartik', 2066, 7, 17, 3),
(24313, '2009-11-04', '18/07/2066', '2066-07-18', 'Kartik', 2066, 7, 18, 4),
(24314, '2009-11-05', '19/07/2066', '2066-07-19', 'Kartik', 2066, 7, 19, 5),
(24315, '2009-11-06', '20/07/2066', '2066-07-20', 'Kartik', 2066, 7, 20, 6),
(24316, '2009-11-07', '21/07/2066', '2066-07-21', 'Kartik', 2066, 7, 21, 7),
(24317, '2009-11-08', '22/07/2066', '2066-07-22', 'Kartik', 2066, 7, 22, 1),
(24318, '2009-11-09', '23/07/2066', '2066-07-23', 'Kartik', 2066, 7, 23, 2),
(24319, '2009-11-10', '24/07/2066', '2066-07-24', 'Kartik', 2066, 7, 24, 3),
(24320, '2009-11-11', '25/07/2066', '2066-07-25', 'Kartik', 2066, 7, 25, 4),
(24321, '2009-11-12', '26/07/2066', '2066-07-26', 'Kartik', 2066, 7, 26, 5),
(24322, '2009-11-13', '27/07/2066', '2066-07-27', 'Kartik', 2066, 7, 27, 6),
(24323, '2009-11-14', '28/07/2066', '2066-07-28', 'Kartik', 2066, 7, 28, 7),
(24324, '2009-11-15', '29/07/2066', '2066-07-29', 'Kartik', 2066, 7, 29, 1),
(24325, '2009-11-16', '01/08/2066', '2066-08-01', 'Marg', 2066, 8, 1, 2),
(24326, '2009-11-17', '02/08/2066', '2066-08-02', 'Marg', 2066, 8, 2, 3),
(24327, '2009-11-18', '03/08/2066', '2066-08-03', 'Marg', 2066, 8, 3, 4),
(24328, '2009-11-19', '04/08/2066', '2066-08-04', 'Marg', 2066, 8, 4, 5),
(24329, '2009-11-20', '05/08/2066', '2066-08-05', 'Marg', 2066, 8, 5, 6),
(24330, '2009-11-21', '06/08/2066', '2066-08-06', 'Marg', 2066, 8, 6, 7),
(24331, '2009-11-22', '07/08/2066', '2066-08-07', 'Marg', 2066, 8, 7, 1),
(24332, '2009-11-23', '08/08/2066', '2066-08-08', 'Marg', 2066, 8, 8, 2),
(24333, '2009-11-24', '09/08/2066', '2066-08-09', 'Marg', 2066, 8, 9, 3),
(24334, '2009-11-25', '10/08/2066', '2066-08-10', 'Marg', 2066, 8, 10, 4),
(24335, '2009-11-26', '11/08/2066', '2066-08-11', 'Marg', 2066, 8, 11, 5),
(24336, '2009-11-27', '12/08/2066', '2066-08-12', 'Marg', 2066, 8, 12, 6),
(24337, '2009-11-28', '13/08/2066', '2066-08-13', 'Marg', 2066, 8, 13, 7),
(24338, '2009-11-29', '14/08/2066', '2066-08-14', 'Marg', 2066, 8, 14, 1),
(24339, '2009-11-30', '15/08/2066', '2066-08-15', 'Marg', 2066, 8, 15, 2),
(24340, '2009-12-01', '16/08/2066', '2066-08-16', 'Marg', 2066, 8, 16, 3),
(24341, '2009-12-02', '17/08/2066', '2066-08-17', 'Marg', 2066, 8, 17, 4),
(24342, '2009-12-03', '18/08/2066', '2066-08-18', 'Marg', 2066, 8, 18, 5),
(24343, '2009-12-04', '19/08/2066', '2066-08-19', 'Marg', 2066, 8, 19, 6),
(24344, '2009-12-05', '20/08/2066', '2066-08-20', 'Marg', 2066, 8, 20, 7),
(24345, '2009-12-06', '21/08/2066', '2066-08-21', 'Marg', 2066, 8, 21, 1),
(24346, '2009-12-07', '22/08/2066', '2066-08-22', 'Marg', 2066, 8, 22, 2),
(24347, '2009-12-08', '23/08/2066', '2066-08-23', 'Marg', 2066, 8, 23, 3),
(24348, '2009-12-09', '24/08/2066', '2066-08-24', 'Marg', 2066, 8, 24, 4),
(24349, '2009-12-10', '25/08/2066', '2066-08-25', 'Marg', 2066, 8, 25, 5),
(24350, '2009-12-11', '26/08/2066', '2066-08-26', 'Marg', 2066, 8, 26, 6),
(24351, '2009-12-12', '27/08/2066', '2066-08-27', 'Marg', 2066, 8, 27, 7),
(24352, '2009-12-13', '28/08/2066', '2066-08-28', 'Marg', 2066, 8, 28, 1),
(24353, '2009-12-14', '29/08/2066', '2066-08-29', 'Marg', 2066, 8, 29, 2),
(24354, '2009-12-15', '30/08/2066', '2066-08-30', 'Marg', 2066, 8, 30, 3),
(24355, '2009-12-16', '01/09/2066', '2066-09-01', 'Poush', 2066, 9, 1, 4),
(24356, '2009-12-17', '02/09/2066', '2066-09-02', 'Poush', 2066, 9, 2, 5),
(24357, '2009-12-18', '03/09/2066', '2066-09-03', 'Poush', 2066, 9, 3, 6),
(24358, '2009-12-19', '04/09/2066', '2066-09-04', 'Poush', 2066, 9, 4, 7),
(24359, '2009-12-20', '05/09/2066', '2066-09-05', 'Poush', 2066, 9, 5, 1),
(24360, '2009-12-21', '06/09/2066', '2066-09-06', 'Poush', 2066, 9, 6, 2),
(24361, '2009-12-22', '07/09/2066', '2066-09-07', 'Poush', 2066, 9, 7, 3),
(24362, '2009-12-23', '08/09/2066', '2066-09-08', 'Poush', 2066, 9, 8, 4),
(24363, '2009-12-24', '09/09/2066', '2066-09-09', 'Poush', 2066, 9, 9, 5),
(24364, '2009-12-25', '10/09/2066', '2066-09-10', 'Poush', 2066, 9, 10, 6),
(24365, '2009-12-26', '11/09/2066', '2066-09-11', 'Poush', 2066, 9, 11, 7),
(24366, '2009-12-27', '12/09/2066', '2066-09-12', 'Poush', 2066, 9, 12, 1),
(24367, '2009-12-28', '13/09/2066', '2066-09-13', 'Poush', 2066, 9, 13, 2),
(24368, '2009-12-29', '14/09/2066', '2066-09-14', 'Poush', 2066, 9, 14, 3),
(24369, '2009-12-30', '15/09/2066', '2066-09-15', 'Poush', 2066, 9, 15, 4),
(24370, '2009-12-31', '16/09/2066', '2066-09-16', 'Poush', 2066, 9, 16, 5),
(24371, '2010-01-01', '17/09/2066', '2066-09-17', 'Poush', 2066, 9, 17, 6),
(24372, '2010-01-02', '18/09/2066', '2066-09-18', 'Poush', 2066, 9, 18, 7),
(24373, '2010-01-03', '19/09/2066', '2066-09-19', 'Poush', 2066, 9, 19, 1),
(24374, '2010-01-04', '20/09/2066', '2066-09-20', 'Poush', 2066, 9, 20, 2),
(24375, '2010-01-05', '21/09/2066', '2066-09-21', 'Poush', 2066, 9, 21, 3),
(24376, '2010-01-06', '22/09/2066', '2066-09-22', 'Poush', 2066, 9, 22, 4),
(24377, '2010-01-07', '23/09/2066', '2066-09-23', 'Poush', 2066, 9, 23, 5),
(24378, '2010-01-08', '24/09/2066', '2066-09-24', 'Poush', 2066, 9, 24, 6),
(24379, '2010-01-09', '25/09/2066', '2066-09-25', 'Poush', 2066, 9, 25, 7),
(24380, '2010-01-10', '26/09/2066', '2066-09-26', 'Poush', 2066, 9, 26, 1),
(24381, '2010-01-11', '27/09/2066', '2066-09-27', 'Poush', 2066, 9, 27, 2),
(24382, '2010-01-12', '28/09/2066', '2066-09-28', 'Poush', 2066, 9, 28, 3),
(24383, '2010-01-13', '29/09/2066', '2066-09-29', 'Poush', 2066, 9, 29, 4),
(24384, '2010-01-14', '30/09/2066', '2066-09-30', 'Poush', 2066, 9, 30, 5),
(24385, '2010-01-15', '01/10/2066', '2066-10-01', 'Magh', 2066, 10, 1, 6),
(24386, '2010-01-16', '02/10/2066', '2066-10-02', 'Magh', 2066, 10, 2, 7),
(24387, '2010-01-17', '03/10/2066', '2066-10-03', 'Magh', 2066, 10, 3, 1),
(24388, '2010-01-18', '04/10/2066', '2066-10-04', 'Magh', 2066, 10, 4, 2),
(24389, '2010-01-19', '05/10/2066', '2066-10-05', 'Magh', 2066, 10, 5, 3),
(24390, '2010-01-20', '06/10/2066', '2066-10-06', 'Magh', 2066, 10, 6, 4),
(24391, '2010-01-21', '07/10/2066', '2066-10-07', 'Magh', 2066, 10, 7, 5),
(24392, '2010-01-22', '08/10/2066', '2066-10-08', 'Magh', 2066, 10, 8, 6),
(24393, '2010-01-23', '09/10/2066', '2066-10-09', 'Magh', 2066, 10, 9, 7),
(24394, '2010-01-24', '10/10/2066', '2066-10-10', 'Magh', 2066, 10, 10, 1),
(24395, '2010-01-25', '11/10/2066', '2066-10-11', 'Magh', 2066, 10, 11, 2),
(24396, '2010-01-26', '12/10/2066', '2066-10-12', 'Magh', 2066, 10, 12, 3),
(24397, '2010-01-27', '13/10/2066', '2066-10-13', 'Magh', 2066, 10, 13, 4),
(24398, '2010-01-28', '14/10/2066', '2066-10-14', 'Magh', 2066, 10, 14, 5),
(24399, '2010-01-29', '15/10/2066', '2066-10-15', 'Magh', 2066, 10, 15, 6),
(24400, '2010-01-30', '16/10/2066', '2066-10-16', 'Magh', 2066, 10, 16, 7),
(24401, '2010-01-31', '17/10/2066', '2066-10-17', 'Magh', 2066, 10, 17, 1),
(24402, '2010-02-01', '18/10/2066', '2066-10-18', 'Magh', 2066, 10, 18, 2),
(24403, '2010-02-02', '19/10/2066', '2066-10-19', 'Magh', 2066, 10, 19, 3),
(24404, '2010-02-03', '20/10/2066', '2066-10-20', 'Magh', 2066, 10, 20, 4),
(24405, '2010-02-04', '21/10/2066', '2066-10-21', 'Magh', 2066, 10, 21, 5),
(24406, '2010-02-05', '22/10/2066', '2066-10-22', 'Magh', 2066, 10, 22, 6),
(24407, '2010-02-06', '23/10/2066', '2066-10-23', 'Magh', 2066, 10, 23, 7),
(24408, '2010-02-07', '24/10/2066', '2066-10-24', 'Magh', 2066, 10, 24, 1),
(24409, '2010-02-08', '25/10/2066', '2066-10-25', 'Magh', 2066, 10, 25, 2),
(24410, '2010-02-09', '26/10/2066', '2066-10-26', 'Magh', 2066, 10, 26, 3),
(24411, '2010-02-10', '27/10/2066', '2066-10-27', 'Magh', 2066, 10, 27, 4),
(24412, '2010-02-11', '28/10/2066', '2066-10-28', 'Magh', 2066, 10, 28, 5),
(24413, '2010-02-12', '29/10/2066', '2066-10-29', 'Magh', 2066, 10, 29, 6),
(24414, '2010-02-13', '01/11/2066', '2066-11-01', 'Falgun', 2066, 11, 1, 7),
(24415, '2010-02-14', '02/11/2066', '2066-11-02', 'Falgun', 2066, 11, 2, 1),
(24416, '2010-02-15', '03/11/2066', '2066-11-03', 'Falgun', 2066, 11, 3, 2),
(24417, '2010-02-16', '04/11/2066', '2066-11-04', 'Falgun', 2066, 11, 4, 3),
(24418, '2010-02-17', '05/11/2066', '2066-11-05', 'Falgun', 2066, 11, 5, 4),
(24419, '2010-02-18', '06/11/2066', '2066-11-06', 'Falgun', 2066, 11, 6, 5),
(24420, '2010-02-19', '07/11/2066', '2066-11-07', 'Falgun', 2066, 11, 7, 6),
(24421, '2010-02-20', '08/11/2066', '2066-11-08', 'Falgun', 2066, 11, 8, 7),
(24422, '2010-02-21', '09/11/2066', '2066-11-09', 'Falgun', 2066, 11, 9, 1),
(24423, '2010-02-22', '10/11/2066', '2066-11-10', 'Falgun', 2066, 11, 10, 2),
(24424, '2010-02-23', '11/11/2066', '2066-11-11', 'Falgun', 2066, 11, 11, 3),
(24425, '2010-02-24', '12/11/2066', '2066-11-12', 'Falgun', 2066, 11, 12, 4),
(24426, '2010-02-25', '13/11/2066', '2066-11-13', 'Falgun', 2066, 11, 13, 5),
(24427, '2010-02-26', '14/11/2066', '2066-11-14', 'Falgun', 2066, 11, 14, 6),
(24428, '2010-02-27', '15/11/2066', '2066-11-15', 'Falgun', 2066, 11, 15, 7),
(24429, '2010-02-28', '16/11/2066', '2066-11-16', 'Falgun', 2066, 11, 16, 1),
(24430, '2010-03-01', '17/11/2066', '2066-11-17', 'Falgun', 2066, 11, 17, 2),
(24431, '2010-03-02', '18/11/2066', '2066-11-18', 'Falgun', 2066, 11, 18, 3),
(24432, '2010-03-03', '19/11/2066', '2066-11-19', 'Falgun', 2066, 11, 19, 4),
(24433, '2010-03-04', '20/11/2066', '2066-11-20', 'Falgun', 2066, 11, 20, 5),
(24434, '2010-03-05', '21/11/2066', '2066-11-21', 'Falgun', 2066, 11, 21, 6),
(24435, '2010-03-06', '22/11/2066', '2066-11-22', 'Falgun', 2066, 11, 22, 7),
(24436, '2010-03-07', '23/11/2066', '2066-11-23', 'Falgun', 2066, 11, 23, 1),
(24437, '2010-03-08', '24/11/2066', '2066-11-24', 'Falgun', 2066, 11, 24, 2),
(24438, '2010-03-09', '25/11/2066', '2066-11-25', 'Falgun', 2066, 11, 25, 3),
(24439, '2010-03-10', '26/11/2066', '2066-11-26', 'Falgun', 2066, 11, 26, 4),
(24440, '2010-03-11', '27/11/2066', '2066-11-27', 'Falgun', 2066, 11, 27, 5),
(24441, '2010-03-12', '28/11/2066', '2066-11-28', 'Falgun', 2066, 11, 28, 6),
(24442, '2010-03-13', '29/11/2066', '2066-11-29', 'Falgun', 2066, 11, 29, 7),
(24443, '2010-03-14', '01/12/2066', '2066-12-01', 'Chaitra', 2066, 12, 1, 1),
(24444, '2010-03-15', '02/12/2066', '2066-12-02', 'Chaitra', 2066, 12, 2, 2),
(24445, '2010-03-16', '03/12/2066', '2066-12-03', 'Chaitra', 2066, 12, 3, 3),
(24446, '2010-03-17', '04/12/2066', '2066-12-04', 'Chaitra', 2066, 12, 4, 4),
(24447, '2010-03-18', '05/12/2066', '2066-12-05', 'Chaitra', 2066, 12, 5, 5),
(24448, '2010-03-19', '06/12/2066', '2066-12-06', 'Chaitra', 2066, 12, 6, 6),
(24449, '2010-03-20', '07/12/2066', '2066-12-07', 'Chaitra', 2066, 12, 7, 7),
(24450, '2010-03-21', '08/12/2066', '2066-12-08', 'Chaitra', 2066, 12, 8, 1),
(24451, '2010-03-22', '09/12/2066', '2066-12-09', 'Chaitra', 2066, 12, 9, 2),
(24452, '2010-03-23', '10/12/2066', '2066-12-10', 'Chaitra', 2066, 12, 10, 3),
(24453, '2010-03-24', '11/12/2066', '2066-12-11', 'Chaitra', 2066, 12, 11, 4),
(24454, '2010-03-25', '12/12/2066', '2066-12-12', 'Chaitra', 2066, 12, 12, 5),
(24455, '2010-03-26', '13/12/2066', '2066-12-13', 'Chaitra', 2066, 12, 13, 6),
(24456, '2010-03-27', '14/12/2066', '2066-12-14', 'Chaitra', 2066, 12, 14, 7),
(24457, '2010-03-28', '15/12/2066', '2066-12-15', 'Chaitra', 2066, 12, 15, 1),
(24458, '2010-03-29', '16/12/2066', '2066-12-16', 'Chaitra', 2066, 12, 16, 2),
(24459, '2010-03-30', '17/12/2066', '2066-12-17', 'Chaitra', 2066, 12, 17, 3),
(24460, '2010-03-31', '18/12/2066', '2066-12-18', 'Chaitra', 2066, 12, 18, 4),
(24461, '2010-04-01', '19/12/2066', '2066-12-19', 'Chaitra', 2066, 12, 19, 5),
(24462, '2010-04-02', '20/12/2066', '2066-12-20', 'Chaitra', 2066, 12, 20, 6),
(24463, '2010-04-03', '21/12/2066', '2066-12-21', 'Chaitra', 2066, 12, 21, 7),
(24464, '2010-04-04', '22/12/2066', '2066-12-22', 'Chaitra', 2066, 12, 22, 1),
(24465, '2010-04-05', '23/12/2066', '2066-12-23', 'Chaitra', 2066, 12, 23, 2),
(24466, '2010-04-06', '24/12/2066', '2066-12-24', 'Chaitra', 2066, 12, 24, 3),
(24467, '2010-04-07', '25/12/2066', '2066-12-25', 'Chaitra', 2066, 12, 25, 4),
(24468, '2010-04-08', '26/12/2066', '2066-12-26', 'Chaitra', 2066, 12, 26, 5),
(24469, '2010-04-09', '27/12/2066', '2066-12-27', 'Chaitra', 2066, 12, 27, 6),
(24470, '2010-04-10', '28/12/2066', '2066-12-28', 'Chaitra', 2066, 12, 28, 7),
(24471, '2010-04-11', '29/12/2066', '2066-12-29', 'Chaitra', 2066, 12, 29, 1),
(24472, '2010-04-12', '30/12/2066', '2066-12-30', 'Chaitra', 2066, 12, 30, 2),
(24473, '2010-04-13', '31/12/2066', '2066-12-31', 'Chaitra', 2066, 12, 31, 3),
(24474, '2010-04-14', '01/01/2067', '2067-01-01', 'Baishakh', 2067, 1, 1, 4),
(24475, '2010-04-15', '02/01/2067', '2067-01-02', 'Baishakh', 2067, 1, 2, 5),
(24476, '2010-04-16', '03/01/2067', '2067-01-03', 'Baishakh', 2067, 1, 3, 6),
(24477, '2010-04-17', '04/01/2067', '2067-01-04', 'Baishakh', 2067, 1, 4, 7),
(24478, '2010-04-18', '05/01/2067', '2067-01-05', 'Baishakh', 2067, 1, 5, 1),
(24479, '2010-04-19', '06/01/2067', '2067-01-06', 'Baishakh', 2067, 1, 6, 2),
(24480, '2010-04-20', '07/01/2067', '2067-01-07', 'Baishakh', 2067, 1, 7, 3),
(24481, '2010-04-21', '08/01/2067', '2067-01-08', 'Baishakh', 2067, 1, 8, 4),
(24482, '2010-04-22', '09/01/2067', '2067-01-09', 'Baishakh', 2067, 1, 9, 5),
(24483, '2010-04-23', '10/01/2067', '2067-01-10', 'Baishakh', 2067, 1, 10, 6),
(24484, '2010-04-24', '11/01/2067', '2067-01-11', 'Baishakh', 2067, 1, 11, 7),
(24485, '2010-04-25', '12/01/2067', '2067-01-12', 'Baishakh', 2067, 1, 12, 1),
(24486, '2010-04-26', '13/01/2067', '2067-01-13', 'Baishakh', 2067, 1, 13, 2),
(24487, '2010-04-27', '14/01/2067', '2067-01-14', 'Baishakh', 2067, 1, 14, 3),
(24488, '2010-04-28', '15/01/2067', '2067-01-15', 'Baishakh', 2067, 1, 15, 4),
(24489, '2010-04-29', '16/01/2067', '2067-01-16', 'Baishakh', 2067, 1, 16, 5),
(24490, '2010-04-30', '17/01/2067', '2067-01-17', 'Baishakh', 2067, 1, 17, 6),
(24491, '2010-05-01', '18/01/2067', '2067-01-18', 'Baishakh', 2067, 1, 18, 7),
(24492, '2010-05-02', '19/01/2067', '2067-01-19', 'Baishakh', 2067, 1, 19, 1),
(24493, '2010-05-03', '20/01/2067', '2067-01-20', 'Baishakh', 2067, 1, 20, 2),
(24494, '2010-05-04', '21/01/2067', '2067-01-21', 'Baishakh', 2067, 1, 21, 3),
(24495, '2010-05-05', '22/01/2067', '2067-01-22', 'Baishakh', 2067, 1, 22, 4),
(24496, '2010-05-06', '23/01/2067', '2067-01-23', 'Baishakh', 2067, 1, 23, 5),
(24497, '2010-05-07', '24/01/2067', '2067-01-24', 'Baishakh', 2067, 1, 24, 6),
(24498, '2010-05-08', '25/01/2067', '2067-01-25', 'Baishakh', 2067, 1, 25, 7),
(24499, '2010-05-09', '26/01/2067', '2067-01-26', 'Baishakh', 2067, 1, 26, 1),
(24500, '2010-05-10', '27/01/2067', '2067-01-27', 'Baishakh', 2067, 1, 27, 2),
(24501, '2010-05-11', '28/01/2067', '2067-01-28', 'Baishakh', 2067, 1, 28, 3),
(24502, '2010-05-12', '29/01/2067', '2067-01-29', 'Baishakh', 2067, 1, 29, 4),
(24503, '2010-05-13', '30/01/2067', '2067-01-30', 'Baishakh', 2067, 1, 30, 5),
(24504, '2010-05-14', '31/01/2067', '2067-01-31', 'Baishakh', 2067, 1, 31, 6),
(24505, '2010-05-15', '01/02/2067', '2067-02-01', 'Jestha', 2067, 2, 1, 7),
(24506, '2010-05-16', '02/02/2067', '2067-02-02', 'Jestha', 2067, 2, 2, 1),
(24507, '2010-05-17', '03/02/2067', '2067-02-03', 'Jestha', 2067, 2, 3, 2),
(24508, '2010-05-18', '04/02/2067', '2067-02-04', 'Jestha', 2067, 2, 4, 3),
(24509, '2010-05-19', '05/02/2067', '2067-02-05', 'Jestha', 2067, 2, 5, 4),
(24510, '2010-05-20', '06/02/2067', '2067-02-06', 'Jestha', 2067, 2, 6, 5),
(24511, '2010-05-21', '07/02/2067', '2067-02-07', 'Jestha', 2067, 2, 7, 6),
